File Location,File Name,Sentence,Label,Intent
/home/lohith/Desktop/EY Hackathon/EY_GDS_Project/data_to_preprocess/Case Study/Seo_Space_Travel_130829.pdf,Seo_Space_Travel_130829.pdf,"heat stroke) and lack of heat would cause hypothermia and death, if no interventions are made[41].",0,Case Study
/home/lohith/Desktop/EY Hackathon/EY_GDS_Project/data_to_preprocess/Case Study/Seo_Space_Travel_130829.pdf,Seo_Space_Travel_130829.pdf,One of the great ways to be protected from these extreme space conditions is to use well- designed space suits.,0,Case Study
/home/lohith/Desktop/EY Hackathon/EY_GDS_Project/data_to_preprocess/Case Study/Seo_Space_Travel_130829.pdf,Seo_Space_Travel_130829.pdf,"The space suit provides breathable air, suitable temperature, moisture, pressure, odor and waste gas removal, as well as shelter from radiation and debris[41].",0,Case Study
/home/lohith/Desktop/EY Hackathon/EY_GDS_Project/data_to_preprocess/Case Study/Seo_Space_Travel_130829.pdf,Seo_Space_Travel_130829.pdf,"However, the conventional soft space suits have had their limitations.",0,Case Study
/home/lohith/Desktop/EY Hackathon/EY_GDS_Project/data_to_preprocess/Case Study/Seo_Space_Travel_130829.pdf,Seo_Space_Travel_130829.pdf,Because having the normal atmospheric pressure (i.e.,0,Case Study
/home/lohith/Desktop/EY Hackathon/EY_GDS_Project/data_to_preprocess/Case Study/Seo_Space_Travel_130829.pdf,Seo_Space_Travel_130829.pdf,"14.7 psi) inside the space suit caused it to balloon out and disable the individual from executing flexible movements, the astronauts needed to go through an adjustment process for several hours to become acclimated to just 3psi of oxygen in the space suit.",0,Case Study
/home/lohith/Desktop/EY Hackathon/EY_GDS_Project/data_to_preprocess/Case Study/Seo_Space_Travel_130829.pdf,Seo_Space_Travel_130829.pdf,This was accomplished by having the individual breathe pure oxygen and have the nitrogen leave their blood through their lungs.,0,Case Study
/home/lohith/Desktop/EY Hackathon/EY_GDS_Project/data_to_preprocess/Case Study/Seo_Space_Travel_130829.pdf,Seo_Space_Travel_130829.pdf,"While this process has been effective, its time requirement posed a major limitation in case of emergencies.",0,Case Study
/home/lohith/Desktop/EY Hackathon/EY_GDS_Project/data_to_preprocess/Case Study/Seo_Space_Travel_130829.pdf,Seo_Space_Travel_130829.pdf,The new space suits in development improves on these limitations by providing the regular atmospheric air pressure in rigid exoskeletons with flexible joints[41].,0,Case Study
/home/lohith/Desktop/EY Hackathon/EY_GDS_Project/data_to_preprocess/Case Study/Seo_Space_Travel_130829.pdf,Seo_Space_Travel_130829.pdf,"c) Exoskeletons With the recently developed assistive machines and robots, human beings can be less prone to weakness in extreme environments and conditions, such as the space environment and age-related conditions.",0,Case Study
/home/lohith/Desktop/EY Hackathon/EY_GDS_Project/data_to_preprocess/Case Study/Seo_Space_Travel_130829.pdf,Seo_Space_Travel_130829.pdf,"In the early years of space travel, passengers needed to go through harsh and rigorous training alongside professional astronauts, in order to get acclimated to the extreme environmental changes in space.",0,Case Study
/home/lohith/Desktop/EY Hackathon/EY_GDS_Project/data_to_preprocess/Case Study/Seo_Space_Travel_130829.pdf,Seo_Space_Travel_130829.pdf,"However, by combining human strength with that of robots, greater strength, speed, endurance, and adaptation can be achieved.",0,Case Study
/home/lohith/Desktop/EY Hackathon/EY_GDS_Project/data_to_preprocess/Case Study/Seo_Space_Travel_130829.pdf,Seo_Space_Travel_130829.pdf,"In other words, exoskeletons will allow for human intelligence and creativity to stay in command, making use of their copious past experiences for dealing with various complex situations and emergencies[46].",0,Case Study
/home/lohith/Desktop/EY Hackathon/EY_GDS_Project/data_to_preprocess/Case Study/Seo_Space_Travel_130829.pdf,Seo_Space_Travel_130829.pdf,"At the same time, the constant micro environment provided by the exoskeleton can protect human capacities from extreme pressures, temperatures, radiation, or collision in space.",0,Case Study
/home/lohith/Desktop/EY Hackathon/EY_GDS_Project/data_to_preprocess/Case Study/Seo_Space_Travel_130829.pdf,Seo_Space_Travel_130829.pdf,This means that lay people would be able to travel into space without as much training by simply wearing the exoskeleton.,0,Case Study
/home/lohith/Desktop/EY Hackathon/EY_GDS_Project/data_to_preprocess/Case Study/Seo_Space_Travel_130829.pdf,Seo_Space_Travel_130829.pdf,"It will also enable space travel for those who are in less than optimal health conditions, for example due to their age.",0,Case Study
/home/lohith/Desktop/EY Hackathon/EY_GDS_Project/data_to_preprocess/Case Study/Seo_Space_Travel_130829.pdf,Seo_Space_Travel_130829.pdf,"Indeed, the strength and speed offered by robotic exoskeletons will enable space travelers to avoid asteroids, space debris, and other obstacles easily, thereby ameliorating some of the anxieties about accidents that could happen in space.",0,Case Study
/home/lohith/Desktop/EY Hackathon/EY_GDS_Project/data_to_preprocess/Case Study/Seo_Space_Travel_130829.pdf,Seo_Space_Travel_130829.pdf,"With the growing market for space tourism, custom designed and versatile exoskeletons will be able to effectively meet the customer’s taste, health conditions, and preferences, the suit should also be and customizable.",0,Case Study
/home/lohith/Desktop/EY Hackathon/EY_GDS_Project/data_to_preprocess/Case Study/Seo_Space_Travel_130829.pdf,Seo_Space_Travel_130829.pdf,"2. a) Cost Cost of Conventional Rockets Space travel has been generally perceived to be an expensive venture, and it has been certainly true.",0,Case Study
/home/lohith/Desktop/EY Hackathon/EY_GDS_Project/data_to_preprocess/Case Study/Seo_Space_Travel_130829.pdf,Seo_Space_Travel_130829.pdf,"The cost of building and launching a rocket through a space program remains exorbitantly high, sometimes costing space program $2.1 billion[47], in this case for NASA’S Ares I program.",0,Case Study
/home/lohith/Desktop/EY Hackathon/EY_GDS_Project/data_to_preprocess/Case Study/Seo_Space_Travel_130829.pdf,Seo_Space_Travel_130829.pdf,"With such a high cost to developing and constructing a spacecraft, the costs inevitably trickle down to the price of a tourism passenger ticket.",0,Case Study
/home/lohith/Desktop/EY Hackathon/EY_GDS_Project/data_to_preprocess/Case Study/Seo_Space_Travel_130829.pdf,Seo_Space_Travel_130829.pdf,"As mentioned briefly in previous sections, the first space tourist passenger Tito paid $20 million to get onboard the Soyuz rocket (see Section B1).",0,Case Study
/home/lohith/Desktop/EY Hackathon/EY_GDS_Project/data_to_preprocess/Case Study/Seo_Space_Travel_130829.pdf,Seo_Space_Travel_130829.pdf,"In the current state of technology, every launch of a space shuttle costs between $500 and $700 million; the cost of launching a pound of mass into a low-earth orbit is about $10,000[48].",0,Case Study
/home/lohith/Desktop/EY Hackathon/EY_GDS_Project/data_to_preprocess/Case Study/Seo_Space_Travel_130829.pdf,Seo_Space_Travel_130829.pdf,"The space station costs more than $100 billion [48], which may increase as agencies attempt to make more habitable space stations for a larger commercial audience.",0,Case Study
/home/lohith/Desktop/EY Hackathon/EY_GDS_Project/data_to_preprocess/Case Study/Seo_Space_Travel_130829.pdf,Seo_Space_Travel_130829.pdf,The chart below describes the costs involved in different types of space and near-space flights.,0,Case Study
/home/lohith/Desktop/EY Hackathon/EY_GDS_Project/data_to_preprocess/Case Study/Seo_Space_Travel_130829.pdf,Seo_Space_Travel_130829.pdf,Higher orbital flights evidently require much longer periods of training and are about 250-500 times more costly than suborbital flights.,0,Case Study
/home/lohith/Desktop/EY Hackathon/EY_GDS_Project/data_to_preprocess/Case Study/Seo_Space_Travel_130829.pdf,Seo_Space_Travel_130829.pdf,Table 1.,0,Case Study
/home/lohith/Desktop/EY Hackathon/EY_GDS_Project/data_to_preprocess/Case Study/Seo_Space_Travel_130829.pdf,Seo_Space_Travel_130829.pdf,"Space-related tourism experiences (Lubin, 2012) b) Cost-reducing Reusable Chemical Rockets Fortunately, there are many surprising ways to cut down the cost of building a rocket while still remaining in the conventional realm, meaning that conventional liquid and solid fuels are used for thrust.",0,Case Study
/home/lohith/Desktop/EY Hackathon/EY_GDS_Project/data_to_preprocess/Case Study/Seo_Space_Travel_130829.pdf,Seo_Space_Travel_130829.pdf,"In fact, progress made by the private space companies has been able to cut down the cost by 75 percent, although the exact percentage depends on how it is calculated[11].",0,Case Study
/home/lohith/Desktop/EY Hackathon/EY_GDS_Project/data_to_preprocess/Case Study/Seo_Space_Travel_130829.pdf,Seo_Space_Travel_130829.pdf,"These advances in the technology have been made for virtually every component of the rocket, including the airframe, engines, electronics, and launch operation.",0,Case Study
/home/lohith/Desktop/EY Hackathon/EY_GDS_Project/data_to_preprocess/Case Study/Seo_Space_Travel_130829.pdf,Seo_Space_Travel_130829.pdf,"These innovations, most of them not patented, ultimately all advance the concept making rockets reusable[7].",0,Case Study
/home/lohith/Desktop/EY Hackathon/EY_GDS_Project/data_to_preprocess/Case Study/Seo_Space_Travel_130829.pdf,Seo_Space_Travel_130829.pdf,"Although the space shuttles had been created as an attempt at this, their main tanks still had to be thrown away at each flight, and the reusable parts required 9 months for a team of 10,000 people to refurbish them – totaling to a cost of billion dollars per flight[11].",0,Case Study
/home/lohith/Desktop/EY Hackathon/EY_GDS_Project/data_to_preprocess/Case Study/Seo_Space_Travel_130829.pdf,Seo_Space_Travel_130829.pdf,"Therefore, Elon Musk and his company of Space X have been devising ways to have the rocket stages return intact to the launch site and be ready for another launch within a few hours.",0,Case Study
/home/lohith/Desktop/EY Hackathon/EY_GDS_Project/data_to_preprocess/Case Study/Seo_Space_Travel_130829.pdf,Seo_Space_Travel_130829.pdf,"In their Grasshopper Test Project, engineers at Space X have been testing vertical landing for the terminal portion of the flight, by enabling the rocket to adjust its angle, the pitch and yaw of the main engine, and to maintain roll with coal gas thrusters.",0,Case Study
/home/lohith/Desktop/EY Hackathon/EY_GDS_Project/data_to_preprocess/Case Study/Seo_Space_Travel_130829.pdf,Seo_Space_Travel_130829.pdf,"Recently, they were able to have a rocket that was the size of a 12-story building to hover at about 40 meters, and return to its landing position[11].",0,Case Study
/home/lohith/Desktop/EY Hackathon/EY_GDS_Project/data_to_preprocess/Case Study/Seo_Space_Travel_130829.pdf,Seo_Space_Travel_130829.pdf,"This relatively simple concept of making the rocket itself more reusable can improve the cost of spaceflight roughly 100-fold, as the cost of the fuel only makes up about .3 percent of the total cost of the rocket.",0,Case Study
/home/lohith/Desktop/EY Hackathon/EY_GDS_Project/data_to_preprocess/Case Study/Seo_Space_Travel_130829.pdf,Seo_Space_Travel_130829.pdf,"Moreover, advances in building rockets with significantly lighter, but stronger material would further decrease the costs for spaceflight, as it would make its energy use as efficient as possible[11].",0,Case Study
/home/lohith/Desktop/EY Hackathon/EY_GDS_Project/data_to_preprocess/Case Study/Seo_Space_Travel_130829.pdf,Seo_Space_Travel_130829.pdf,III.,0,Case Study
/home/lohith/Desktop/EY Hackathon/EY_GDS_Project/data_to_preprocess/Case Study/Seo_Space_Travel_130829.pdf,Seo_Space_Travel_130829.pdf,Problems with Conventional Propulsions and Alternative Solutions A.,0,Case Study
/home/lohith/Desktop/EY Hackathon/EY_GDS_Project/data_to_preprocess/Case Study/Seo_Space_Travel_130829.pdf,Seo_Space_Travel_130829.pdf,"Conventional Chemical Rockets There are currently three different types of rockets that use solid, liquid, or hybrid fuels [49].",0,Case Study
/home/lohith/Desktop/EY Hackathon/EY_GDS_Project/data_to_preprocess/Case Study/Seo_Space_Travel_130829.pdf,Seo_Space_Travel_130829.pdf,The commonality among the three types is that they all use a propellant to thrust the rocket forward.,0,Case Study
/home/lohith/Desktop/EY Hackathon/EY_GDS_Project/data_to_preprocess/Case Study/Seo_Space_Travel_130829.pdf,Seo_Space_Travel_130829.pdf,"Propellants are chemical mixtures of a type of fuel and oxygen, which burn upon contact.",0,Case Study
/home/lohith/Desktop/EY Hackathon/EY_GDS_Project/data_to_preprocess/Case Study/Seo_Space_Travel_130829.pdf,Seo_Space_Travel_130829.pdf,a) Solid propellant Solid propellant rockets are the most primitive form of rockets.,0,Case Study
/home/lohith/Desktop/EY Hackathon/EY_GDS_Project/data_to_preprocess/Case Study/Seo_Space_Travel_130829.pdf,Seo_Space_Travel_130829.pdf,"Solid rockets were invented much before liquid propellant rockets, and this includes the ancient firework rockets that were used in wars long ago.",0,Case Study
/home/lohith/Desktop/EY Hackathon/EY_GDS_Project/data_to_preprocess/Case Study/Seo_Space_Travel_130829.pdf,Seo_Space_Travel_130829.pdf,"Departing from the use of gunpowder in ancient times, modern solid fueled rockets use more powerful fuels[49].",0,Case Study
/home/lohith/Desktop/EY Hackathon/EY_GDS_Project/data_to_preprocess/Case Study/Seo_Space_Travel_130829.pdf,Seo_Space_Travel_130829.pdf,Solid propellant motors have simple designs and are easy to handle.,0,Case Study
/home/lohith/Desktop/EY Hackathon/EY_GDS_Project/data_to_preprocess/Case Study/Seo_Space_Travel_130829.pdf,Seo_Space_Travel_130829.pdf,They are usually consisting of solid compounds which are mad of fuel and oxidizer and contained in a steel casing.,0,Case Study
/home/lohith/Desktop/EY Hackathon/EY_GDS_Project/data_to_preprocess/Case Study/Seo_Space_Travel_130829.pdf,Seo_Space_Travel_130829.pdf,"They burn at a very fast speed, from the center towards the outer sides of the casing and expel hot gases to produce thrust.",0,Case Study
/home/lohith/Desktop/EY Hackathon/EY_GDS_Project/data_to_preprocess/Case Study/Seo_Space_Travel_130829.pdf,Seo_Space_Travel_130829.pdf,"The shape of the center channel determines how fast the fuel burns and its patterns, which is a good way to control thrust[50].",0,Case Study
/home/lohith/Desktop/EY Hackathon/EY_GDS_Project/data_to_preprocess/Case Study/Seo_Space_Travel_130829.pdf,Seo_Space_Travel_130829.pdf,The factors used in determining the rocket’s performance that is related to the center channel are its surface area and specific impulse.,0,Case Study
/home/lohith/Desktop/EY Hackathon/EY_GDS_Project/data_to_preprocess/Case Study/Seo_Space_Travel_130829.pdf,Seo_Space_Travel_130829.pdf,"The amount of propellant exposed to interior combustion flames outlines the surface area, giving a direct relationship with thrust.",0,Case Study
/home/lohith/Desktop/EY Hackathon/EY_GDS_Project/data_to_preprocess/Case Study/Seo_Space_Travel_130829.pdf,Seo_Space_Travel_130829.pdf,"An increase in surface area will increase thrust, but reduces in burning time of fuel because the propellant is being used at a faster rate[50].",0,Case Study
/home/lohith/Desktop/EY Hackathon/EY_GDS_Project/data_to_preprocess/Case Study/Seo_Space_Travel_130829.pdf,Seo_Space_Travel_130829.pdf,"On the other hand, if surface area of the channel is decreased, burning time will be increased, thus decreasing the thrust.",0,Case Study
/home/lohith/Desktop/EY Hackathon/EY_GDS_Project/data_to_preprocess/Case Study/Seo_Space_Travel_130829.pdf,Seo_Space_Travel_130829.pdf,The most ideal thrust is represented by a constant rate of thrust.,0,Case Study
/home/lohith/Desktop/EY Hackathon/EY_GDS_Project/data_to_preprocess/Case Study/Seo_Space_Travel_130829.pdf,Seo_Space_Travel_130829.pdf,This can be achieved by sustaining same surface area throughout the burn.,0,Case Study
/home/lohith/Desktop/EY Hackathon/EY_GDS_Project/data_to_preprocess/Case Study/Seo_Space_Travel_130829.pdf,Seo_Space_Travel_130829.pdf,"For examples, there are end burning, internal-core burning, outer-core burning, and internal star core burning used as designs of constant surface area.",0,Case Study
/home/lohith/Desktop/EY Hackathon/EY_GDS_Project/data_to_preprocess/Case Study/Seo_Space_Travel_130829.pdf,Seo_Space_Travel_130829.pdf,Various shapes are used to optimize the thrust[50].,0,Case Study
/home/lohith/Desktop/EY Hackathon/EY_GDS_Project/data_to_preprocess/Case Study/Seo_Space_Travel_130829.pdf,Seo_Space_Travel_130829.pdf,"As previously mentioned, specific impulse also determines rocket performance by controlling internal thrust production through pressure and heat.",0,Case Study
/home/lohith/Desktop/EY Hackathon/EY_GDS_Project/data_to_preprocess/Case Study/Seo_Space_Travel_130829.pdf,Seo_Space_Travel_130829.pdf,Specific impulse is defined by the thrust per unit propellant burned in each second.,0,Case Study
/home/lohith/Desktop/EY Hackathon/EY_GDS_Project/data_to_preprocess/Case Study/Seo_Space_Travel_130829.pdf,Seo_Space_Travel_130829.pdf,During the ignition of an explosive fuel hot and expanding gasses are created to produce thrust.,0,Case Study
/home/lohith/Desktop/EY Hackathon/EY_GDS_Project/data_to_preprocess/Case Study/Seo_Space_Travel_130829.pdf,Seo_Space_Travel_130829.pdf,How large of the fuel's explosive power is and how fast combustion takes place regulate the specific impulse.,0,Case Study
/home/lohith/Desktop/EY Hackathon/EY_GDS_Project/data_to_preprocess/Case Study/Seo_Space_Travel_130829.pdf,Seo_Space_Travel_130829.pdf,Specific impulse must be considered carefully to successfully optimize producing thrust[50].,0,Case Study
/home/lohith/Desktop/EY Hackathon/EY_GDS_Project/data_to_preprocess/Case Study/Seo_Space_Travel_130829.pdf,Seo_Space_Travel_130829.pdf,"There are two different types of solid propellants, namely homogeneous and composite[51].",0,Case Study
/home/lohith/Desktop/EY Hackathon/EY_GDS_Project/data_to_preprocess/Case Study/Seo_Space_Travel_130829.pdf,Seo_Space_Travel_130829.pdf,"Both are dense, and can be easily stored and operated stably at ordinary temperatures.",0,Case Study
/home/lohith/Desktop/EY Hackathon/EY_GDS_Project/data_to_preprocess/Case Study/Seo_Space_Travel_130829.pdf,Seo_Space_Travel_130829.pdf,Homogeneous propellants can consist of either simple base or double base.,0,Case Study
/home/lohith/Desktop/EY Hackathon/EY_GDS_Project/data_to_preprocess/Case Study/Seo_Space_Travel_130829.pdf,Seo_Space_Travel_130829.pdf,"For a simple base propellant, a single compound is used.",0,Case Study
/home/lohith/Desktop/EY Hackathon/EY_GDS_Project/data_to_preprocess/Case Study/Seo_Space_Travel_130829.pdf,Seo_Space_Travel_130829.pdf,"Nitrocellulose is frequently used, since it has both an oxidation and reduction capacity.",0,Case Study
/home/lohith/Desktop/EY Hackathon/EY_GDS_Project/data_to_preprocess/Case Study/Seo_Space_Travel_130829.pdf,Seo_Space_Travel_130829.pdf,Double base propellants have two compounds (usually nitrocellulose and nitroglycerine) and a plasticizer is added to increase the plasticity or fluidity of a material.,0,Case Study
/home/lohith/Desktop/EY Hackathon/EY_GDS_Project/data_to_preprocess/Case Study/Seo_Space_Travel_130829.pdf,Seo_Space_Travel_130829.pdf,Homogeneous propellants are relatively weak.,0,Case Study
/home/lohith/Desktop/EY Hackathon/EY_GDS_Project/data_to_preprocess/Case Study/Seo_Space_Travel_130829.pdf,Seo_Space_Travel_130829.pdf,"Normally, their specific impulses are less than about 210 seconds, but they have an advantage of not producing traceable smoke.",0,Case Study
/home/lohith/Desktop/EY Hackathon/EY_GDS_Project/data_to_preprocess/Case Study/Seo_Space_Travel_130829.pdf,Seo_Space_Travel_130829.pdf,"Thus, homogenous propellants are often used as strategic weapons[50].",0,Case Study
/home/lohith/Desktop/EY Hackathon/EY_GDS_Project/data_to_preprocess/Case Study/Seo_Space_Travel_130829.pdf,Seo_Space_Travel_130829.pdf,"They are also used as secondary functions of rocket launches in tasks, like discarding spent parts or separating one stage from another[50].",0,Case Study
/home/lohith/Desktop/EY Hackathon/EY_GDS_Project/data_to_preprocess/Case Study/Seo_Space_Travel_130829.pdf,Seo_Space_Travel_130829.pdf,Composite propellants consist of heterogeneous powders or mixtures.,0,Case Study
/home/lohith/Desktop/EY Hackathon/EY_GDS_Project/data_to_preprocess/Case Study/Seo_Space_Travel_130829.pdf,Seo_Space_Travel_130829.pdf,"Fuel is generally made of aluminum and for oxidizers, crystallized or finely ground mineral salt is used.",0,Case Study
/home/lohith/Desktop/EY Hackathon/EY_GDS_Project/data_to_preprocess/Case Study/Seo_Space_Travel_130829.pdf,Seo_Space_Travel_130829.pdf,"More specifically, ammonium perchlorate is commonly used as an oxidizer and usually occupies between 60% and 90% of the mass of the propellant.",0,Case Study
/home/lohith/Desktop/EY Hackathon/EY_GDS_Project/data_to_preprocess/Case Study/Seo_Space_Travel_130829.pdf,Seo_Space_Travel_130829.pdf,"The propellant is held together by a polymeric binder (usually polyurethane or polybutadienes), which is also consumed as fuel.",0,Case Study
/home/lohith/Desktop/EY Hackathon/EY_GDS_Project/data_to_preprocess/Case Study/Seo_Space_Travel_130829.pdf,Seo_Space_Travel_130829.pdf,Sometimes catalyst is included to help speeding up the burning rate.,0,Case Study
/home/lohith/Desktop/EY Hackathon/EY_GDS_Project/data_to_preprocess/Case Study/Seo_Space_Travel_130829.pdf,Seo_Space_Travel_130829.pdf,Other agents can be also included to make the mixtures easier to fabricate[51].,0,Case Study
/home/lohith/Desktop/EY Hackathon/EY_GDS_Project/data_to_preprocess/Case Study/Seo_Space_Travel_130829.pdf,Seo_Space_Travel_130829.pdf,"In terms of their classification, composite propellants are classified or defined by the type of polymeric binder used.",0,Case Study
/home/lohith/Desktop/EY Hackathon/EY_GDS_Project/data_to_preprocess/Case Study/Seo_Space_Travel_130829.pdf,Seo_Space_Travel_130829.pdf,The two most common binders are polybutadiene acrylic acid acrylonitrile (PBAN) and hydroxy-terminator polybutadiene (HTPB).,0,Case Study
/home/lohith/Desktop/EY Hackathon/EY_GDS_Project/data_to_preprocess/Case Study/Seo_Space_Travel_130829.pdf,Seo_Space_Travel_130829.pdf,"PBAN gives slightly higher specific impulse, density, and burning rate than equivalent amount of HTPB.",0,Case Study
/home/lohith/Desktop/EY Hackathon/EY_GDS_Project/data_to_preprocess/Case Study/Seo_Space_Travel_130829.pdf,Seo_Space_Travel_130829.pdf,"On the other hand, PBAN propellant is a lot more difficult to handle since it is harder to mix and process, also requiring an elevated curing temperature.",0,Case Study
/home/lohith/Desktop/EY Hackathon/EY_GDS_Project/data_to_preprocess/Case Study/Seo_Space_Travel_130829.pdf,Seo_Space_Travel_130829.pdf,"On the other hand, HTPB propellant is stronger in stronger and more flexible to use than PBAN.",0,Case Study
/home/lohith/Desktop/EY Hackathon/EY_GDS_Project/data_to_preprocess/Case Study/Seo_Space_Travel_130829.pdf,Seo_Space_Travel_130829.pdf,"Both PBAN and HTPB propellants deliver excellent performance with good mechanical properties, and gives long time of burning[51].",0,Case Study
/home/lohith/Desktop/EY Hackathon/EY_GDS_Project/data_to_preprocess/Case Study/Seo_Space_Travel_130829.pdf,Seo_Space_Travel_130829.pdf,Solid propellant motors can be used in many ways.,0,Case Study
/home/lohith/Desktop/EY Hackathon/EY_GDS_Project/data_to_preprocess/Case Study/Seo_Space_Travel_130829.pdf,Seo_Space_Travel_130829.pdf,"Small solid propellant motors are usually used to power the final stage of a launch rocket, or attached to cargos to be lifted to higher orbits.",0,Case Study
/home/lohith/Desktop/EY Hackathon/EY_GDS_Project/data_to_preprocess/Case Study/Seo_Space_Travel_130829.pdf,Seo_Space_Travel_130829.pdf,Medium solid propellant motors such as the Payload Assist Module (PAM) and the Inertial Upper Stage (IUS) are used as boosters needed to place satellites into geosynchronous orbit or on planetary trajectories.,0,Case Study
/home/lohith/Desktop/EY Hackathon/EY_GDS_Project/data_to_preprocess/Case Study/Seo_Space_Travel_130829.pdf,Seo_Space_Travel_130829.pdf,"The Titan, Delta, and Space Shuttle launch vehicles used solid propellant rockets to provide additional thrust during the lift-off.",0,Case Study
/home/lohith/Desktop/EY Hackathon/EY_GDS_Project/data_to_preprocess/Case Study/Seo_Space_Travel_130829.pdf,Seo_Space_Travel_130829.pdf,The Space Shuttle uses the largest solid rocket motors ever built and flown.,0,Case Study
/home/lohith/Desktop/EY Hackathon/EY_GDS_Project/data_to_preprocess/Case Study/Seo_Space_Travel_130829.pdf,Seo_Space_Travel_130829.pdf,"Each booster contains 500,000 kg of propellant and can produce up to 14,680,000 Newtons of thrust force[51].",0,Case Study
/home/lohith/Desktop/EY Hackathon/EY_GDS_Project/data_to_preprocess/Case Study/Seo_Space_Travel_130829.pdf,Seo_Space_Travel_130829.pdf,b) Liquid propellant Liquid propellant rockets are a lot more powerful than solid propellant rockets.,0,Case Study
/home/lohith/Desktop/EY Hackathon/EY_GDS_Project/data_to_preprocess/Case Study/Seo_Space_Travel_130829.pdf,Seo_Space_Travel_130829.pdf,"With high thrust capacities, it enabled first human flights into space.",0,Case Study
/home/lohith/Desktop/EY Hackathon/EY_GDS_Project/data_to_preprocess/Case Study/Seo_Space_Travel_130829.pdf,Seo_Space_Travel_130829.pdf,"Although liquid fueled rockets burn fuel and oxidizer like conventional solid fuels rockets, both fuel and oxidizer are in liquid states[52].",0,Case Study
