File Location,File Name,Sentence,Label,Intent
/home/lohith/Desktop/EY Hackathon/EY_GDS_Project/data_to_preprocess/Case Study/Seo_Space_Travel_130829.pdf,Seo_Space_Travel_130829.pdf,"Not only do they fly well in a vacuum, Goddard discovered that the rockets fly at even faster speeds in vacuum than in air, because vacuum does not have air resistance to reduce the rocket’s thrust.",0,Case Study
/home/lohith/Desktop/EY Hackathon/EY_GDS_Project/data_to_preprocess/Case Study/Seo_Space_Travel_130829.pdf,Seo_Space_Travel_130829.pdf,"Goddard also became the first person to develop liquid-fuel for rockets, which were evidently more efficient than solid fuel despite some of its disadvantages (e.g.",0,Case Study
/home/lohith/Desktop/EY Hackathon/EY_GDS_Project/data_to_preprocess/Case Study/Seo_Space_Travel_130829.pdf,Seo_Space_Travel_130829.pdf,"harder to handle, must be kept in separate tanks, and in very low temperatures of -300ºF)[16], [17].",0,Case Study
/home/lohith/Desktop/EY Hackathon/EY_GDS_Project/data_to_preprocess/Case Study/Seo_Space_Travel_130829.pdf,Seo_Space_Travel_130829.pdf,"Goddard launched his first rocket in Auburn, Massachusetts in 1926 and continued to build engines and more complex rockets into his later life in New Mexico.",0,Case Study
/home/lohith/Desktop/EY Hackathon/EY_GDS_Project/data_to_preprocess/Case Study/Seo_Space_Travel_130829.pdf,Seo_Space_Travel_130829.pdf,"Lastly, Hermann Oberth studied the requirements for interplanetary travel.",0,Case Study
/home/lohith/Desktop/EY Hackathon/EY_GDS_Project/data_to_preprocess/Case Study/Seo_Space_Travel_130829.pdf,Seo_Space_Travel_130829.pdf,"He also was instrumental in promoting rocket science through his paper called, “By Rocket into Planetary Space,” which referenced Goddard’s work to present space travel as more of real science than just science fiction.",0,Case Study
/home/lohith/Desktop/EY Hackathon/EY_GDS_Project/data_to_preprocess/Case Study/Seo_Space_Travel_130829.pdf,Seo_Space_Travel_130829.pdf,"It is said that by reading Oberth’s paper Tsiolkovsky became incited to publish his own work and new theories[16], [17].",0,Case Study
/home/lohith/Desktop/EY Hackathon/EY_GDS_Project/data_to_preprocess/Case Study/Seo_Space_Travel_130829.pdf,Seo_Space_Travel_130829.pdf,2,0,Case Study
/home/lohith/Desktop/EY Hackathon/EY_GDS_Project/data_to_preprocess/Case Study/Seo_Space_Travel_130829.pdf,Seo_Space_Travel_130829.pdf,"History of Human Space Travel Thanks to the pioneering work of the abovementioned Fathers of Modern Rocketry, the science of space travel has long reached a level where trained astronauts could travel into space.",0,Case Study
/home/lohith/Desktop/EY Hackathon/EY_GDS_Project/data_to_preprocess/Case Study/Seo_Space_Travel_130829.pdf,Seo_Space_Travel_130829.pdf,"After the Soviet Union launched the first artificial satellite Sputnik into orbit in October 1957, Sputnik 2 soon followed a month later, this time carrying the first animal into space.",0,Case Study
/home/lohith/Desktop/EY Hackathon/EY_GDS_Project/data_to_preprocess/Case Study/Seo_Space_Travel_130829.pdf,Seo_Space_Travel_130829.pdf,"Though the first dog Laika only survived for 4 hours in space due to malfunctioning environmental control system, 13 other dogs and animals were successfully sent and safely returned to Earth before the first human flight[17], [18].",0,Case Study
/home/lohith/Desktop/EY Hackathon/EY_GDS_Project/data_to_preprocess/Case Study/Seo_Space_Travel_130829.pdf,Seo_Space_Travel_130829.pdf,"With the Soviet successes in space, the United States joined in competition and started the oft-called space race between the two countries.",0,Case Study
/home/lohith/Desktop/EY Hackathon/EY_GDS_Project/data_to_preprocess/Case Study/Seo_Space_Travel_130829.pdf,Seo_Space_Travel_130829.pdf,President Eisenhower instituted the National Aeronautics and Space Administration (NASA) in 1958 to engage more fully in the goal to send human beings into space.,0,Case Study
/home/lohith/Desktop/EY Hackathon/EY_GDS_Project/data_to_preprocess/Case Study/Seo_Space_Travel_130829.pdf,Seo_Space_Travel_130829.pdf,"Besides this main goal, NASA sent probes to explore the earth’s space environment: the moon and other planets, as well as the sun and stars[16].",0,Case Study
/home/lohith/Desktop/EY Hackathon/EY_GDS_Project/data_to_preprocess/Case Study/Seo_Space_Travel_130829.pdf,Seo_Space_Travel_130829.pdf,"In the same year, Project Mercury was created with the sole purpose of sending Americans into the outer space, on orbital flights.",0,Case Study
/home/lohith/Desktop/EY Hackathon/EY_GDS_Project/data_to_preprocess/Case Study/Seo_Space_Travel_130829.pdf,Seo_Space_Travel_130829.pdf,"Starting from the year 1961, the Project trained and sent 7 young pilots who became the nation’s first astronauts.",0,Case Study
/home/lohith/Desktop/EY Hackathon/EY_GDS_Project/data_to_preprocess/Case Study/Seo_Space_Travel_130829.pdf,Seo_Space_Travel_130829.pdf,"Although the Project had hoped that one of these 7 would become the first man in space, in April 1961, Yuri Gagarin of Soviet Union claimed the honor – just a few weeks before the U.S.’s Alan Shepard went into space in May 1961[19].",0,Case Study
/home/lohith/Desktop/EY Hackathon/EY_GDS_Project/data_to_preprocess/Case Study/Seo_Space_Travel_130829.pdf,Seo_Space_Travel_130829.pdf,"Yuri Gagarin thus became the first human to be in sub-orbital space, flying in the spacecraft Vostok.",0,Case Study
/home/lohith/Desktop/EY Hackathon/EY_GDS_Project/data_to_preprocess/Case Study/Seo_Space_Travel_130829.pdf,Seo_Space_Travel_130829.pdf,"Despite the concerns over the negative health effects of weightlessness, Gagarin returned unharmed and functioned normally.",0,Case Study
/home/lohith/Desktop/EY Hackathon/EY_GDS_Project/data_to_preprocess/Case Study/Seo_Space_Travel_130829.pdf,Seo_Space_Travel_130829.pdf,Valentina Tereshkova soon became the first woman to be in space for 3 days on Vostok 6 in 1963.,0,Case Study
/home/lohith/Desktop/EY Hackathon/EY_GDS_Project/data_to_preprocess/Case Study/Seo_Space_Travel_130829.pdf,Seo_Space_Travel_130829.pdf,These successes of Vostok missions were followed by improvements to the spacecraft that would enable even travel around the moon[18].,0,Case Study
/home/lohith/Desktop/EY Hackathon/EY_GDS_Project/data_to_preprocess/Case Study/Seo_Space_Travel_130829.pdf,Seo_Space_Travel_130829.pdf,"This new generation of spaceships was called Voskhod, and it became the first multi- person spacecraft, carrying 3 cosmonauts crammed into the cabin designed for one.",0,Case Study
/home/lohith/Desktop/EY Hackathon/EY_GDS_Project/data_to_preprocess/Case Study/Seo_Space_Travel_130829.pdf,Seo_Space_Travel_130829.pdf,"On Voskhod 2, Alexei Leonov then became the first man to make a spacewalk that lasted for about 12 minutes in 1965.",0,Case Study
/home/lohith/Desktop/EY Hackathon/EY_GDS_Project/data_to_preprocess/Case Study/Seo_Space_Travel_130829.pdf,Seo_Space_Travel_130829.pdf,"However, the Voskhod missions were discontinued when the Soviet Union decided to focus its energies on the moon race with the United States[19].",0,Case Study
/home/lohith/Desktop/EY Hackathon/EY_GDS_Project/data_to_preprocess/Case Study/Seo_Space_Travel_130829.pdf,Seo_Space_Travel_130829.pdf,The competition between Soviet Union and United States on striving to reach the moon first was a fierce one.,0,Case Study
/home/lohith/Desktop/EY Hackathon/EY_GDS_Project/data_to_preprocess/Case Study/Seo_Space_Travel_130829.pdf,Seo_Space_Travel_130829.pdf,"Former President John F. Kennedy even presented this issue in a “Special Message to the Congress on Urgent National Needs,” urging the Congress to quickly create a space program rivaling the Soviets[20].",0,Case Study
/home/lohith/Desktop/EY Hackathon/EY_GDS_Project/data_to_preprocess/Case Study/Seo_Space_Travel_130829.pdf,Seo_Space_Travel_130829.pdf,"Thus, in 1961, in the midst of the Cold War, the U.S. created the Apollo program with the aim to reach the moon by the end of the decade.",0,Case Study
/home/lohith/Desktop/EY Hackathon/EY_GDS_Project/data_to_preprocess/Case Study/Seo_Space_Travel_130829.pdf,Seo_Space_Travel_130829.pdf,"After several successful orbiting around the moon, United States finally had Neil Armstrong land on the surface of the moon through Apollo 11 in 1969.",0,Case Study
/home/lohith/Desktop/EY Hackathon/EY_GDS_Project/data_to_preprocess/Case Study/Seo_Space_Travel_130829.pdf,Seo_Space_Travel_130829.pdf,"This feat was accomplished by building and launching two separate space crafts, Apollo and Saturn V, in order to cover the long distance to the moon.",0,Case Study
/home/lohith/Desktop/EY Hackathon/EY_GDS_Project/data_to_preprocess/Case Study/Seo_Space_Travel_130829.pdf,Seo_Space_Travel_130829.pdf,"Saturn V, one of the largest rockets ever flown successfully, took Apollo half way to the moon then launched it into the lunar trajectory.",0,Case Study
/home/lohith/Desktop/EY Hackathon/EY_GDS_Project/data_to_preprocess/Case Study/Seo_Space_Travel_130829.pdf,Seo_Space_Travel_130829.pdf,"The 6 teams of astronauts sent through the Apollo program landed successfully on the moon and collected data on observations and experiments, and brought samples of the lunar dust and rocks[19].",0,Case Study
/home/lohith/Desktop/EY Hackathon/EY_GDS_Project/data_to_preprocess/Case Study/Seo_Space_Travel_130829.pdf,Seo_Space_Travel_130829.pdf,"The next challenge for the aeronautical community was forging an international collaboration, leaving behind the era of international competition between the U.S. and the Soviet Union.",0,Case Study
/home/lohith/Desktop/EY Hackathon/EY_GDS_Project/data_to_preprocess/Case Study/Seo_Space_Travel_130829.pdf,Seo_Space_Travel_130829.pdf,"In 1975, they had Apollo-Soyuz Test Project as the first international space mission.",0,Case Study
/home/lohith/Desktop/EY Hackathon/EY_GDS_Project/data_to_preprocess/Case Study/Seo_Space_Travel_130829.pdf,Seo_Space_Travel_130829.pdf,"Soyuz spacecraft launched from the center in Central Asia, and Apollo from the Kennedy Space Center in Florida.",0,Case Study
/home/lohith/Desktop/EY Hackathon/EY_GDS_Project/data_to_preprocess/Case Study/Seo_Space_Travel_130829.pdf,Seo_Space_Travel_130829.pdf,The two crew teams met in orbit and visited each other’s space crafts[21].,0,Case Study
/home/lohith/Desktop/EY Hackathon/EY_GDS_Project/data_to_preprocess/Case Study/Seo_Space_Travel_130829.pdf,Seo_Space_Travel_130829.pdf,"This paved the way for the future ventures, including the sending of U.S. space missions to the Russian Mir space station.",0,Case Study
/home/lohith/Desktop/EY Hackathon/EY_GDS_Project/data_to_preprocess/Case Study/Seo_Space_Travel_130829.pdf,Seo_Space_Travel_130829.pdf,European nations also joined in this international trend by creating a European Space Agency (ESA) in the same year of 1975.,0,Case Study
/home/lohith/Desktop/EY Hackathon/EY_GDS_Project/data_to_preprocess/Case Study/Seo_Space_Travel_130829.pdf,Seo_Space_Travel_130829.pdf,"These 15 nations were: Austria, Belgium, Denmark, Finland, France, Germany, Ireland, Italy, Netherlands, Norway, Portugal, Spain, Sweden, Switzerland, and the United Kingdom.",0,Case Study
/home/lohith/Desktop/EY Hackathon/EY_GDS_Project/data_to_preprocess/Case Study/Seo_Space_Travel_130829.pdf,Seo_Space_Travel_130829.pdf,"The ESA participated in many solar system missions, with a large budget reaching 3.1 billion U.S. dollars in 2003[21].",0,Case Study
/home/lohith/Desktop/EY Hackathon/EY_GDS_Project/data_to_preprocess/Case Study/Seo_Space_Travel_130829.pdf,Seo_Space_Travel_130829.pdf,"The active international space collaboration is well exemplified in the establishment of the International Space Station, which now orbits the Earth as the largest artificial object in space as well as the habitat of longest human presence in space (13 years).",0,Case Study
/home/lohith/Desktop/EY Hackathon/EY_GDS_Project/data_to_preprocess/Case Study/Seo_Space_Travel_130829.pdf,Seo_Space_Travel_130829.pdf,"ISS was created as a merger of three space station projects in 1993, with components for Russian Mir-2, American Freedom, European Columbus space station programs.",0,Case Study
/home/lohith/Desktop/EY Hackathon/EY_GDS_Project/data_to_preprocess/Case Study/Seo_Space_Travel_130829.pdf,Seo_Space_Travel_130829.pdf,"In this microgravity and space research environment, astronauts and cosmonauts from 15 different nations have visited and conducted various experiments.",0,Case Study
/home/lohith/Desktop/EY Hackathon/EY_GDS_Project/data_to_preprocess/Case Study/Seo_Space_Travel_130829.pdf,Seo_Space_Travel_130829.pdf,"Finally, in 2003 China became the third nation to launch a human into space, aboard the Shenzhou 5.",0,Case Study
/home/lohith/Desktop/EY Hackathon/EY_GDS_Project/data_to_preprocess/Case Study/Seo_Space_Travel_130829.pdf,Seo_Space_Travel_130829.pdf,"China’s own space station, Tiangong, was finally launched into space in 2011[22].",0,Case Study
/home/lohith/Desktop/EY Hackathon/EY_GDS_Project/data_to_preprocess/Case Study/Seo_Space_Travel_130829.pdf,Seo_Space_Travel_130829.pdf,"However, the history of space travel was not without tragedy.",0,Case Study
/home/lohith/Desktop/EY Hackathon/EY_GDS_Project/data_to_preprocess/Case Study/Seo_Space_Travel_130829.pdf,Seo_Space_Travel_130829.pdf,There were several accidents that cost lives and caused a lot of media coverage and international upheaval.,0,Case Study
/home/lohith/Desktop/EY Hackathon/EY_GDS_Project/data_to_preprocess/Case Study/Seo_Space_Travel_130829.pdf,Seo_Space_Travel_130829.pdf,"In 1967, for example, Vladimir Komarov of Soviet Union died in a crash of Soyuz 1 due to a series of technical issues, including parachute failure after re-entry into the Earth’s atmosphere.",0,Case Study
/home/lohith/Desktop/EY Hackathon/EY_GDS_Project/data_to_preprocess/Case Study/Seo_Space_Travel_130829.pdf,Seo_Space_Travel_130829.pdf,"As Komarov’s death was the first to occur during space flight, the tragic incident spurred the development of improvements in spaceship design[23].",0,Case Study
/home/lohith/Desktop/EY Hackathon/EY_GDS_Project/data_to_preprocess/Case Study/Seo_Space_Travel_130829.pdf,Seo_Space_Travel_130829.pdf,"In the United States, the Challenger space shuttle exploded in 1986 after 73 seconds into its flight, killing 7 crew members.",0,Case Study
/home/lohith/Desktop/EY Hackathon/EY_GDS_Project/data_to_preprocess/Case Study/Seo_Space_Travel_130829.pdf,Seo_Space_Travel_130829.pdf,"In reaction to this tragedy, the U.S. space program was grounded for 32 months, as the public and program questioned and weighed the safety of space flight[2], [23], [24].",0,Case Study
/home/lohith/Desktop/EY Hackathon/EY_GDS_Project/data_to_preprocess/Case Study/Seo_Space_Travel_130829.pdf,Seo_Space_Travel_130829.pdf,"After the Challenger accident, further launches were prohibited for any vehicle loaded with commercial payload.",0,Case Study
/home/lohith/Desktop/EY Hackathon/EY_GDS_Project/data_to_preprocess/Case Study/Seo_Space_Travel_130829.pdf,Seo_Space_Travel_130829.pdf,"As commercial launches were prohibited for the U.S. government space program, this instigated the development of private sector space exploration companies.",0,Case Study
/home/lohith/Desktop/EY Hackathon/EY_GDS_Project/data_to_preprocess/Case Study/Seo_Space_Travel_130829.pdf,Seo_Space_Travel_130829.pdf,"As of 2013, he last recorded space casualty occurred in 2003 with the space shuttle Columbia, which disintegrated with its 7 crew members while re-entering the Earth after a 2-week mission, due to structural failures after encountering problems in its thermal protection system[23].",0,Case Study
/home/lohith/Desktop/EY Hackathon/EY_GDS_Project/data_to_preprocess/Case Study/Seo_Space_Travel_130829.pdf,Seo_Space_Travel_130829.pdf,"In total, 18 out of the 430 humans who flew in space have died, 14 on two shuttle missions and four on two Soyuz flights.",0,Case Study
/home/lohith/Desktop/EY Hackathon/EY_GDS_Project/data_to_preprocess/Case Study/Seo_Space_Travel_130829.pdf,Seo_Space_Travel_130829.pdf,"This is equivalent to the fatality rate of 4.19 percent, though the rate is somewhat inflated by counting those who have flown on multiple flights.",0,Case Study
/home/lohith/Desktop/EY Hackathon/EY_GDS_Project/data_to_preprocess/Case Study/Seo_Space_Travel_130829.pdf,Seo_Space_Travel_130829.pdf,"Compared to other adventures, this rate is similar to the one for climbing Mt.",0,Case Study
/home/lohith/Desktop/EY Hackathon/EY_GDS_Project/data_to_preprocess/Case Study/Seo_Space_Travel_130829.pdf,Seo_Space_Travel_130829.pdf,Everest.,0,Case Study
/home/lohith/Desktop/EY Hackathon/EY_GDS_Project/data_to_preprocess/Case Study/Seo_Space_Travel_130829.pdf,Seo_Space_Travel_130829.pdf,"However, Rich Hauck, a former astronaut and CEO of AXA Space, a leading space insurance company, believes the risk of death needs to be decreased before public space travel becomes widely accepted.",0,Case Study
/home/lohith/Desktop/EY Hackathon/EY_GDS_Project/data_to_preprocess/Case Study/Seo_Space_Travel_130829.pdf,Seo_Space_Travel_130829.pdf,"In order for the public feel safe enough to travel to space, the fatality rate should be reduced to less than 1 percent, Hauck said.",0,Case Study
/home/lohith/Desktop/EY Hackathon/EY_GDS_Project/data_to_preprocess/Case Study/Seo_Space_Travel_130829.pdf,Seo_Space_Travel_130829.pdf,"As a reference, that is about the same percent risk that the typical American encounters during one’s lifetime, dying in an ordinary traffic accident[24].",0,Case Study
/home/lohith/Desktop/EY Hackathon/EY_GDS_Project/data_to_preprocess/Case Study/Seo_Space_Travel_130829.pdf,Seo_Space_Travel_130829.pdf,3,0,Case Study
/home/lohith/Desktop/EY Hackathon/EY_GDS_Project/data_to_preprocess/Case Study/Seo_Space_Travel_130829.pdf,Seo_Space_Travel_130829.pdf,History of Space Shuttles NASA has been planning to build a reusable spaceship beginning in the 1960s.,0,Case Study
/home/lohith/Desktop/EY Hackathon/EY_GDS_Project/data_to_preprocess/Case Study/Seo_Space_Travel_130829.pdf,Seo_Space_Travel_130829.pdf,"In 1972, the Congress gave NASA the permission to start the shuttle program.",0,Case Study
/home/lohith/Desktop/EY Hackathon/EY_GDS_Project/data_to_preprocess/Case Study/Seo_Space_Travel_130829.pdf,Seo_Space_Travel_130829.pdf,"[25] Due to budget constraints, however, NASA cut the development costs through combining the use of reusable and throw-away elements in the shuttle design[25].",0,Case Study
/home/lohith/Desktop/EY Hackathon/EY_GDS_Project/data_to_preprocess/Case Study/Seo_Space_Travel_130829.pdf,Seo_Space_Travel_130829.pdf,"Big wing span as big as a mid-sized passenger airplane, and capacity for up to 8 astronauts.",0,Case Study
/home/lohith/Desktop/EY Hackathon/EY_GDS_Project/data_to_preprocess/Case Study/Seo_Space_Travel_130829.pdf,Seo_Space_Travel_130829.pdf,"It had several main areas, namely the crew cabin, cargo bay, and liquid fuel for rocket engines that enable the launch and maneuver of the shuttle in space, as well as its return to Earth.",0,Case Study
/home/lohith/Desktop/EY Hackathon/EY_GDS_Project/data_to_preprocess/Case Study/Seo_Space_Travel_130829.pdf,Seo_Space_Travel_130829.pdf,"Among its protection system, the most important is the thermal protection system to protect the shuttle from intensive heat during the re-entering of the Earth’s atmosphere.",0,Case Study
/home/lohith/Desktop/EY Hackathon/EY_GDS_Project/data_to_preprocess/Case Study/Seo_Space_Travel_130829.pdf,Seo_Space_Travel_130829.pdf,"These orbiter shuttles are designed to land on the runway of the Kennedy Space Center, gliding in its final moments as an unpowered glider.",0,Case Study
/home/lohith/Desktop/EY Hackathon/EY_GDS_Project/data_to_preprocess/Case Study/Seo_Space_Travel_130829.pdf,Seo_Space_Travel_130829.pdf,"They made five of these shuttles: Columbia, Challenger, Discovery, Endeavour, and Atlantis[26].",0,Case Study
/home/lohith/Desktop/EY Hackathon/EY_GDS_Project/data_to_preprocess/Case Study/Seo_Space_Travel_130829.pdf,Seo_Space_Travel_130829.pdf,"From its first flight in 1981, space shuttles have flown many different missions.",0,Case Study
/home/lohith/Desktop/EY Hackathon/EY_GDS_Project/data_to_preprocess/Case Study/Seo_Space_Travel_130829.pdf,Seo_Space_Travel_130829.pdf,"For example, the space shuttle Columbia flew 28 missions, before disintegrating during its re-entry after its last mission[26].",0,Case Study
/home/lohith/Desktop/EY Hackathon/EY_GDS_Project/data_to_preprocess/Case Study/Seo_Space_Travel_130829.pdf,Seo_Space_Travel_130829.pdf,"The shuttles’ missions included deploying satellites, capturing them in orbit for repair, and returning them to earth; leading many scientific experiments, such as the study of how weightlessness affects living organisms; and becoming observational sites for studying the heavenly bodies of the universe.",0,Case Study
/home/lohith/Desktop/EY Hackathon/EY_GDS_Project/data_to_preprocess/Case Study/Seo_Space_Travel_130829.pdf,Seo_Space_Travel_130829.pdf,Perhaps the most crucial mission of the U.S. space shuttle was the launching of the famous Hubble Telescope by Discovery in 1990.,0,Case Study
/home/lohith/Desktop/EY Hackathon/EY_GDS_Project/data_to_preprocess/Case Study/Seo_Space_Travel_130829.pdf,Seo_Space_Travel_130829.pdf,"The shuttles even flew secret missions for the Departments of Defense, and played crucial roles in constructing the ISS[26].",0,Case Study
/home/lohith/Desktop/EY Hackathon/EY_GDS_Project/data_to_preprocess/Case Study/Seo_Space_Travel_130829.pdf,Seo_Space_Travel_130829.pdf,"Despite its versatility and reusablity, the space shuttle program has largely failed in reducing the costs of human space flight.",0,Case Study
/home/lohith/Desktop/EY Hackathon/EY_GDS_Project/data_to_preprocess/Case Study/Seo_Space_Travel_130829.pdf,Seo_Space_Travel_130829.pdf,"Because of its complexity, the shuttle required lots of maintenance between each mission; and after its risk was underscored after two shuttles crashed and killed all of its crew members, the shuttle program was stopped in 2011[26].",0,Case Study
/home/lohith/Desktop/EY Hackathon/EY_GDS_Project/data_to_preprocess/Case Study/Seo_Space_Travel_130829.pdf,Seo_Space_Travel_130829.pdf,B.,0,Case Study
/home/lohith/Desktop/EY Hackathon/EY_GDS_Project/data_to_preprocess/Case Study/Seo_Space_Travel_130829.pdf,Seo_Space_Travel_130829.pdf,1,0,Case Study
/home/lohith/Desktop/EY Hackathon/EY_GDS_Project/data_to_preprocess/Case Study/Seo_Space_Travel_130829.pdf,Seo_Space_Travel_130829.pdf,"Current Status of Space Travel Space tourism Today, new kinds of space travel are emerging.",0,Case Study
/home/lohith/Desktop/EY Hackathon/EY_GDS_Project/data_to_preprocess/Case Study/Seo_Space_Travel_130829.pdf,Seo_Space_Travel_130829.pdf,"The year 2001 marked the beginning of space tourism, as a wealthy California businessman, Dennis Tito, became the first paying passenger for space flight[27].",0,Case Study
/home/lohith/Desktop/EY Hackathon/EY_GDS_Project/data_to_preprocess/Case Study/Seo_Space_Travel_130829.pdf,Seo_Space_Travel_130829.pdf,"He paid $20 million to be launched by Soyuz TM-32 via arrangements made between an American company called Space Adventures and a Russian company MirCorp, which oversaw the Mir space station.",0,Case Study
/home/lohith/Desktop/EY Hackathon/EY_GDS_Project/data_to_preprocess/Case Study/Seo_Space_Travel_130829.pdf,Seo_Space_Travel_130829.pdf,"The ticket sale was to fund the maintenance of the Mir space station; however, a premature deorbit decision diverted Tito’s destination to the ISS.",0,Case Study
/home/lohith/Desktop/EY Hackathon/EY_GDS_Project/data_to_preprocess/Case Study/Seo_Space_Travel_130829.pdf,Seo_Space_Travel_130829.pdf,"For 8 days, Tito enjoyed a unique vacation in orbit and spent seven days on board the ISS[27], [28].",0,Case Study
/home/lohith/Desktop/EY Hackathon/EY_GDS_Project/data_to_preprocess/Case Study/Seo_Space_Travel_130829.pdf,Seo_Space_Travel_130829.pdf,"Initially, there were many controversies in NASA in regards to the possible delays that such tourism would cause for the scheduled work.",0,Case Study
/home/lohith/Desktop/EY Hackathon/EY_GDS_Project/data_to_preprocess/Case Study/Seo_Space_Travel_130829.pdf,Seo_Space_Travel_130829.pdf,"However, the concerns proved to be unfounded as no delays were experienced[28].",0,Case Study
/home/lohith/Desktop/EY Hackathon/EY_GDS_Project/data_to_preprocess/Case Study/Seo_Space_Travel_130829.pdf,Seo_Space_Travel_130829.pdf,"Many other laypersons followed Tito’s footsteps: Mark Shuttleworth, a South African technology entrepreneur in 2002; Gregory Olsen, an American entrepreneur-engineer-scientist in 2005; Anousheh Ansari, an Iranian American businesswoman in 2006; and several other wealthy persons[27].",0,Case Study
/home/lohith/Desktop/EY Hackathon/EY_GDS_Project/data_to_preprocess/Case Study/Seo_Space_Travel_130829.pdf,Seo_Space_Travel_130829.pdf,"Given the orbital nature of these flights, most of these commercial space travelers needed to go through arduous training for their missions, alongside professional astronauts.",0,Case Study
/home/lohith/Desktop/EY Hackathon/EY_GDS_Project/data_to_preprocess/Case Study/Seo_Space_Travel_130829.pdf,Seo_Space_Travel_130829.pdf,"However, several private companies are developing suborbital space vehicles to commercialize space travel, which would take passengers to an altitude of 100 km (62 miles)[27].",0,Case Study
/home/lohith/Desktop/EY Hackathon/EY_GDS_Project/data_to_preprocess/Case Study/Seo_Space_Travel_130829.pdf,Seo_Space_Travel_130829.pdf,"In the coming years, it is expected that such suborbital space tourism will become more affordable, safer, and easier for a wider range of customers [28].",0,Case Study
