text,intent
To integrate CalWIN with Documentum required signiﬁcant code changes to CalWIN but being a legacy application code changes to CalWIN were really not an option,Case Study
It would not be an overstatement to say that the applications of space technology have improved the medical system in the US as well as its economy,Case Study
In reaction to this tragedy the US space program was grounded for 32 months as the public and program questioned and weighed the safety of space flight2 23 24,Case Study
 NASAJSC Office of Public Affairs NASA Technology Spinoffs Bringing Space Down to Earth Benefits from Space 27Apr2000,Case Study
No additional resources were required for custom programming,Case Study
This press release including the reconciliations of certain non GAAP measures to their nearest comparable GAAP measures is also available on that site,Financial Reports
 E Musk Elon Musk The mind behind Tesla SpaceX SolarCity,Case Study
When creating new components however never use deprecated libraries,Coding Guidelines
Automation Anywheres noninvasive approach was the solution,Case Study
Facebook uses the investorfbcom and newsroomfbcom websites as well as Mark Zuckerbergs Facebook Page httpswwwfacebookcomzuck as means of disclosing material nonpublic information and for complying with its disclosure obligations under Regulation FD,Financial Reports
Lastly even the difference in smell of flowers have been noted and applied into an actual fragrance by the Japanese cosmetics company Shiseido naming this unique floral scent Zen64,Case Study
 Volunteer Surge a nonprofit consortium is running its online training platform on AWS to recruit train and deploy one million volunteer health workers,Financial Reports
For example 3000000000L rather than 3000000000l,Coding Guidelines
The position and configuration of the traveling superconducting disk can easily be changed by rotation and it will continue to move freely in its new position54,Case Study
The beneﬁts of automating these systems A noninvasive solution reduced costs and risk,Case Study
 Any logging thats meant to be read by other people and to be available in release builds should be terse without being cryptic and should be understandable,Coding Guidelines
 J Wright Using Sunlight Solar Pressure Space Sailing Technical Section 2007,Case Study
The amount of propellant exposed to interior combustion flames outlines the surface area giving a direct relationship with thrust,Case Study
In addition please note that the date of this press release is April 25 2018 and any forwardlooking statements contained herein are based on assumptions that we believe to be reasonable as of this date,Financial Reports
 Customers are using AWS to lessen the impact that COVID19 has on families communities and businesses,Financial Reports
Some members of the company attended a conference where they learned about Robotic Process Automation RPA saw how automation technology was being used and realized it made sense for their business,Case Study
NonGAAP operating income We define nonGAAP operating income as operating income excluding certain charges,Financial Reports
Typical responses are to log it or if it is considered impossible rethrow it as an AssertionError,Coding Guidelines
But these arent normal circumstances,Financial Reports
A series of large satellites are needed to launch into space as well as robotic technology to assemble the solar arrays and microwave technology to transmit the energy 22000 miles to earth from space then finally converting that energy to electricity on the ground,Case Study
Available httpwwwspacesettlementinstituteorgprivatespacecompanieshtml,Case Study
We undertake no obligation to update these statements as a result of new information or future events,Financial Reports
However essentially space is not a state of complete void or nothingness but is a physical reality as a continuum which can be reacted against under a certain condition53,Case Study
In most cases you can use good exception handling instead,Coding Guidelines
Before any open curly brace  with two exceptions  SomeAnnotationa b no space is used  String x  foo no space is required between  by item 8 4,Case Study
While this process has been effective its time requirement posed a major limitation in case of emergencies,Case Study
Husch Blackwell Paving the Way for RPA in the Law Industry PROFILE ORGANIZATION With headquarters in Kansas City Missouri Husch Blackwell is a law firm of approximately 700 attorneys in 19 offices across the US,Case Study
Usually the liquid is used as the oxidizer while the solid is used as fuel,Case Study
Seamless execution on 2000 computers  SMART Automation Technology The agents all use dierent computer conﬁgurations  so any solution would have to adjust to several parameters like screen sizes and resolutions operating systems and dierent platforms including Citrix and then run the automated tasks seamlessly on each computer,Case Study
During the postsurvey participants provided demographic information ie,Case Study
Tip A common mistake is to write simple Javadoc in the form  return the customer ID ,Coding Guidelines
 We evaluated many other products but we chose AA because of its ﬂexibility to integrate with legacy systems I would recommend AA for its ﬂexibility to integrate and automate processes of any kind  Vinesh Goyal ECM Practice Director Burntsand Corporation Integrated solution provider digitized ECM project for San Diego CountySan Diego County  Health and Human Services AgencyAn Automation Anywhere Case StudyGo be great,Case Study
_T_ In previous rockets 95 of their weight was fuel,Case Study
 Comments This section addresses implementation comments,Coding Guidelines
Currently NanoSailD which is about the size of a loaf of bread is being tracked by amateur radio operators called hams by listening for the little satellites signal at 437270 MHz,Case Study
Hypothetical Ion Propulsion for Deep Space Despite the decades of history now in launching spacecrafts into space modern spacecrafts still are restricted by the problem of fuel,Case Study
After  or the closing parenthesis  of a cast 7,Case Study
We have committed over 300 million to date in investments to help our broader community during the crisis including creating a 100 million grant program to help small businesses and investing 100 million to support the news industry,Financial Reports
In space flames instead break apart into little balls that move around freely burning while using almost no fuel,Case Study
For me this is a dream come true,Case Study
Quarter Ended March 31 2019 22547 3025 25572 5015 30587 1825 3620 36032 170 137 36339 2020 24502 4038 28540 5223 33763 2777 4435 40975 135 49 41159 6860 7452 103459 123048 Quarter Ended March 31 2019 2020 9270 Google operating income 1121 Other Bets operating loss The EC fine is included in reconciling items for the quarter ended March 31 2019 as it is not allocated to Google for segment reporting purposes,Financial Reports
Tribe said the beauty of the Story Time projectpart of the nonprofit Global Space Education Foundationlies in its simplicity,Case Study
This first project donation is part of Amazons Right Now Climate Fund  a 100 million commitment to protect restore and support reforestation projects around the world in collaboration with The Nature Conservancy,Financial Reports
 Capital expenditures  Capital expenditures including principal payments on finance leases were 366 billion for the first quarter of 2020,Financial Reports
The technologies that led to the computer bar codes in retail stores quartz timing crystals and household smoke detectors were originally developed for NASA63,Case Study
If there are both static and nonstatic imports a single blank line separates the two blocks,Case Study
Reconciling items are related to timing differences of payments as segment capital expenditures are on an accrual basis while total capital expenditures shown on the Consolidated Statements of Cash Flows are on a cash basis and other miscellaneous differences,Financial Reports
The call begins today at 130 PM PT  430 PM ET,Financial Reports
Not only do they fly well in a vacuum Goddard discovered that the rockets fly at even faster speeds in vacuum than in air because vacuum does not have air resistance to reduce the rockets thrust,Case Study
The first launch is being planned to take place at ISS after VASMIR is taken into orbit by a traditional chemical rocket,Case Study
For oxidizer of liquid motors liquid oxygen is used the most,Case Study
In addition remember that a Deprecated method is still supposed to work,Coding Guidelines
A 25 said yes 735 4 said no 117 5 said they were not sure 147,Case Study
 2 3 3 4 4 5 5 Compared to my peers I tend to take more risks in life,Case Study
A Majority of participants 23 were students 3 were teachers 1 was a small business owner 1 worked for Real Estates and 1 was associated directorteacher,Case Study
When that time comes SpaceShipTwo will be carried to launch altitude 1525 km by a jetpowered mothership the Scaled Composites White Knight Two before turning up its rocket engines to fly up to 110 km in the upper atmosphere,Case Study
On January 26th 1998 the International Space Station ISS was signed by 16 countries as joint collaboration,Case Study
Important it is not appropriate to cite this exception to justify omitting relevant information that a typical reader might need to know,Coding Guidelines
Mineola NY Dover Publications 1998,Case Study
Once implemented it will be able to process courthouse documents in different formats extract needed information and perform whatever automation is desired,Case Study
Onecharacter parameter names in public methods should be avoided,Coding Guidelines
Lines where obeying the column limit is not possible for example a long URL in Javadoc or a long JSNI method reference,Case Study
 This also applies to the following operatorlike symbols  the dot separator ,Case Study
After spending her childhood in South Korea she came to the United States to pursue her dreams,Case Study
_T_ NASA plans to return to the moon by the year 2020 and build a livable colony there,Case Study
For example   TODO The thirdparty class comthirdusefulUtilityrotate needs generics SuppressWarningsgenericcast ListString blix  Utilityrotateblax When a SuppressWarnings annotation is required refactor the code to isolate the software elements where the annotation applies,Coding Guidelines
Please avoid format or concatenation in performance critical sections of code,Coding Guidelines
harder to handle must be kept in separate tanks and in very low temperatures of 300ºF16 17,Case Study
_F_ Space exploration has been just a political show for big countries and has not brought any benefit to society,Case Study
On both sides of any binary or ternary operator,Case Study
A The averages scale from the respondents was 338 and Standard deviation was 128,Case Study
Liquid propellants are classified as petroleum cryogenic hypergolic,Case Study
Amazon AppFlow also works with AWS PrivateLink to route data flows through the AWS network instead of over the public Internet to provide even stronger data privacy and security,Financial Reports
An exceptional hybrid engine was used however for the vehicle SpaceShipOne burning nitrous oxide as the liquid oxidizer and HTPB rubber as the solid fuel powered,Case Study
Yes No Not sure Did the talk help you see the societal benefits of space exploration,Case Study
About Amazon Amazon is guided by four principles customer obsession rather than competitor focus passion for invention commitment to operational excellence and longterm thinking,Financial Reports
 Cash and cash equivalents and marketable securities  Cash and cash equivalents and marketable  Headcount  Headcount was 27742 as of March 31 2018 an increase of 48 yearoveryear,Financial Reports
 Revenue  We experienced a significant reduction in the demand for advertising as well as a related decline in the pricing of our ads over the last three weeks of the first quarter of 2020,Financial Reports
Additionally thirdparty sellers sold more than 700 million items that shipped with Prime Free OneDay Delivery or faster in the US in 2019,Financial Reports
For Q1 2020 the net effect of the loss on equity securities of 814 million and the performance fees reversal of 6 million decreased income tax net income and diluted EPS by 170 million 638 million and 092 respectively,Financial Reports
 M D Lemonick Solar Power from Space Moving Beyond Science Fiction Yale Environment 360 31Aug2009,Case Study
Propellants are chemical mixtures of a type of fuel and oxygen which burn upon contact,Case Study
Q What is your approximate yearly income,Case Study
 M Bellis How a Solid Propellant Rocket Works How Rockets Work,Case Study
Under this Act every commercial space launch landing and operation will be attended and evaluated by FAA representatives all spaceflight participants will also be guided through an informed consent process in writing about the risks of launch and reentry including the safety record of the launch vehicle27,Case Study
Soyuz spacecraft launched from the center in Central Asia and Apollo from the Kennedy Space Center in Florida,Case Study
Discover how Automation Anywhere can give your business an edge,Case Study
On the other hand PBAN propellant is a lot more difficult to handle since it is harder to mix and process also requiring an elevated curing temperature,Case Study
In 1967 for example Vladimir Komarov of Soviet Union died in a crash of Soyuz 1 due to a series of technical issues including parachute failure after reentry into the Earths atmosphere,Case Study
These fast moving plasma particles are guided by strong magnetic fields from the engines magnet to have them shoot out and create thrust,Case Study
 Package statement The package statement is not linewrapped,Case Study
 of participants got it right,Case Study
As a last resort if youre confident that ignoring the exception is appropriate then you may ignore it but you must also comment why with a good reason,Coding Guidelines
We subtract purchases of property and equipment in our calculation of free cash flow because we believe that this methodology can provide useful supplemental information to help investors better understand underlying trends in our business,Financial Reports
Supporting documents used to qualify every individual for various government assistance programs like food stamps the Supplemental Nutrition Program Temporary Assistance for Needy Families Medical and more were being transferred onto a digital format using EMC Documentum,Case Study
 Three Months Ended March 31 2018 11966  1927 2238 1595 757 6517 5449 161 5610 622 4988  1 4987  172  169  2906 2945 56  718 109 72 955  2017 8032 1159 1834 1057 655 4705 3327 81 3408 344 3064 5 3059 106 104 2891 2944 34 670 96 67 867 CONDENSED CONSOLIDATED STATEMENTS OF INCOME In millions except for per share amounts FACEBOOK INC Unaudited Revenue Costs and expenses Cost of revenue Research and development Marketing and sales General and administrative Total costs and expenses Income from operations Interest and other income net Income before provision for income taxes Provision for income taxes Net income Less Net income attributable to participating securities Net income attributable to Class A and Class B common stockholders Earnings per share attributable to Class A and Class B common stockholders Basic Diluted Weighted average shares used to compute earnings per share attributable to Class A and Class B common stockholders Basic Diluted Sharebased compensation expense included in costs and expenses Cost of revenue Research and development Marketing and sales General and administrative Total sharebased compensation expense        4 FACEBOOK INC CONDENSED CONSOLIDATED BALANCE SHEETS In millions Unaudited March 31 2018 8079 33632 5832 1020 48563 13721 1884 18221 2135 84524 December 31 2017 12082  31874 5115 1341 50412 16211 1735 18268 2319 88945  593  396 4003 94 5086 6239 11325 41134 294  36780 77620 88945  380 390 2892 98 3760 6417 10177 40584 227  33990 74347 84524 Total current assets Assets Current assets Cash and cash equivalents Marketable securities Accounts receivable net of allowances of 204 and 189 as of March 31 2018 and December 31 2017 respectively Prepaid expenses and other current assets Property and equipment net Intangible assets net Goodwill Other assets Total assets Liabilities and stockholders equity Current liabilities Accounts payable Partners payable Accrued expenses and other current liabilities Deferred revenue and deposits Other liabilities Total liabilities Stockholders equity Common stock and additional paidin capital Accumulated other comprehensive loss Retained earnings Total liabilities and stockholders equity Total stockholders equity Total current liabilities     5 CONDENSED CONSOLIDATED STATEMENTS OF CASH FLOWS FACEBOOK INC In millions Unaudited Net income Adjustments to reconcile net income to net cash provided by operating activities Cash flows from operating activities Depreciation and amortization Sharebased compensation Deferred income taxes Other Changes in assets and liabilities Accounts receivable Prepaid expenses and other current assets Other assets Accounts payable Partners payable Accrued expenses and other current liabilities Deferred revenue and deposits Other liabilities Net cash provided by operating activities Cash flows from investing activities Three Months Ended March 31 2018 4988  949 955 47  8 788 365  22 1 2 707 5  143  7860 2812  4022  4330 1267 49  1  1287  832  1774  3 2603  36 4006 8204 12210  2017 3064 671 867 84  5 609 365  31 10  3  61 10  222 5058 1271  6992  1762 599  18  5920  771  228  7 992  28 1826  9109 7283    Purchases of property and equipment Purchases of marketable securities Sales of marketable securities Maturities of marketable securities Acquisitions of businesses net of cash acquired and purchases of intangible assets Other investing activities net Net cash used in investing activities Cash flows from financing activities Taxes paid related to net share settlement of equity awards Repurchases of Class A common stock Other financing activities net Net cash used in financing activities Effect of exchange rate changes on cash cash equivalents and restricted cash Net increase decrease in cash cash equivalents and restricted cash Cash cash equivalents and restricted cash at beginning of year Cash cash equivalents and restricted cash at end of the period Reconciliation of cash cash equivalents and restricted cash to the condensed consolidated balance sheets Cash and cash equivalents Restricted cash included in prepaid expenses and other current assets Restricted cash included in other assets Total cash cash equivalents and restricted cash Priorperiod information has been retrospectively adjusted due to our adoption of ASU No,Financial Reports
So we chose a style updated the style guide and made the IDEs obey it,Coding Guidelines
There are definitely times when it is actually the correct thing to do but at least you have to think about it,Coding Guidelines
Very often there are several valid ways to linewrap the same piece of code,Case Study
 of participants got it right,Case Study
The number of correct answers that participants provided for the presurvey questions was on average 868 out of 14 questions asked,Case Study
For example Almog demonstrated that on top of a large circular magnetic rail the superconducting disk moves freely along the rail as a monorail train would but without the friction,Case Study
Ethyl alcohol ethanol was used as a fuel source for the German V2 missile and the USA Redstone but became obsolete after more efficient fuels were developed,Case Study
 Total expenses  We expect to realize operational expense savings in certain areas such as travel events and marketing as well as from slower headcount growth in our business functions,Financial Reports
This paved the way for the future ventures including the sending of US space missions to the Russian Mir space station,Case Study
A lifter most likely powered by electrical motors receiving electricity from photovoltaic cells galvanized by freeelectron lasers will ascend and descend along the cable carrying different payloads as well as humans7 17,Case Study
return ufeff  content  byte order mark Good use escapes for nonprintable characters and comment if necessary,Case Study
 Exception Blank lines between enum constants are covered in 2,Case Study
Superconductors and Quantum Locking One of the exciting developments that open new possibilities for space travel is the discovery of quantum levitation and quantum locking54,Case Study
