text,intent
Although its performance and density is high similar to that of nitric acid and it is far less toxic and corrosive but it is unstable with a poor freezing point,Case Study
After looking at scalability security and the departments that were mature enough to manage their own bots Husch Blackwell began automating processes specific to its law practice,Case Study
Dont refactor the logging call out into a method call if its going to cause the string building to take place outside of the if LOCAL_LOG block,Coding Guidelines
On November 26 1965 French Army launched their first satellite A1 which was built by their own and later renamed as Asterix,Case Study
Android doesnt enforce a specific style for writing Javadoc comments but you should follow the instructions in How to Write Doc Comments for the Javadoc Tool,Coding Guidelines
In this case its appropriate but not required to print a short log message from the finalizer as long as its not expected to flood the logs,Coding Guidelines
In 1975 they had ApolloSoyuz Test Project as the first international space mission,Case Study
strands of magnetic field inside the superconductor come in discrete quantities and behave like quantum particles54,Case Study
Given the depth of the challenges so many are facing its a huge privilege to be able to help at this time said Sundar Pichai Chief Executive Officer of Alphabet and Google,Financial Reports
___ In the future regular people will be able to go into space,Case Study
 J Amos Urgent need to remove space debris BBC 25Apr2013,Case Study
Second the amount of water that can be transported into space is limited due to its weight43,Case Study
On October 4th 1959 Luna 3 photographed about 70 of the far side of the moon,Case Study
At the present time NASA is operating an Orbital Debris Program since 1995 conducting research in modeling measurements protection mitigation and reentry aspects40,Case Study
___ Space exploration has been just a political show for big countries and has not brought any benefit to society,Case Study
 Indentation As with any other block the contents of a switch block are indented 2,Case Study
Customers can ask Alexa what do I do if I think I have COVID19 or Alexa what do I do if I think I have coronavirus Alexa then asks a series of questions about the persons symptoms and possible exposure and provides guidance sourced from local health authorities,Financial Reports
Starting from the year 1961 the Project trained and sent 7 young pilots who became the nations first astronauts,Case Study
Following the end of the quarter we entered into an agreement to invest in Jio Platforms Limited a subsidiary of Reliance Industries Limited for approximately 57 billion and we paid the 50 billion settlement amount due under our modified consent order with the FTC which took effect in April 2020,Financial Reports
However some difficulty exists in that the ISS generally needs 30 hours of advance notice to be maneuvered and that several tens of thousands of smaller pieces move undetected and cause harm 36,Case Study
Example Override Nullable public String getNameIfPresent    Exception A single parameterless annotation may instead appear together with the first line of the signature for example Override public int hashCode    Annotations applying to a field also appear immediately after the documentation block but in this case multiple annotations possibly parameterized may be listed on the same line for example Partial Mock DataLoader loader There are no specific rules for formatting annotations on parameters local variables or types,Coding Guidelines
Were working to provide accurate and timely information from official government and news sources globally,Financial Reports
 Where to break The prime directive of linewrapping is prefer to break at a higher syntactic level,Case Study
A English Spanish Portuguese Polish Russian Croatian Korean Chinese Japanese Arabic and Thai were used,Case Study
While you may think your code will never encounter this error condition or that it isnt important to handle it ignoring this type of exception creates mines in your code for someone else to trigger some day,Coding Guidelines
Though liquid propellants are more challenging to store in this way than solid fuels they offer distinct advantages such as high speed exhaust gas ejection and ability to throttle including stop andrestart capability and emergency shutdown,Case Study
Exception Multiple variable declarations are acceptable in the header of a for loop,Case Study
 Empty blocks may be concise An empty block or blocklike construct may be in K  R style as described in Section 412,Case Study
Purchases of property and equipment net Principal payments on finance leases,Financial Reports
The presentation of these financial measures is not intended to be considered in isolation or as a substitute for or superior to financial information prepared and presented in accordance with GAAP,Financial Reports
 Column limit 100 Java code has a column limit of 100 characters,Case Study
Treat acronyms as words Treat acronyms and abbreviations as words in naming variables methods and classes to make names more readable Good Bad XmlHttpRequest XMLHTTPRequest getCustomerId getCustomerID class Html String url long id class HTML String URL long ID As both the JDK and the Android code bases are inconsistent around acronyms its virtually impossible to be consistent with the surrounding code,Coding Guidelines
_T_ The first time humans landed on the moon was 40 years ago and we have not gone back since,Case Study
Your responses on the survey will be completely anonymous and private,Case Study
try  int i  IntegerparseIntresponse return handleNumericResponsei  catch NumberFormatException ok   its not numeric thats fine just continue  return handleTextResponseresponse Exception In tests a caught exception may be ignored without comment if its name is or begins with expected,Coding Guidelines
License or copyright information if present 2,Case Study
 2 3 4 5 Compared to my peers I tend to like staying at home and be comfortable in familiar places,Case Study
Nearly every local variable declaration should contain an initializer,Coding Guidelines
History of Human Space Travel Thanks to the pioneering work of the abovementioned Fathers of Modern Rocketry the science of space travel has long reached a level where trained astronauts could travel into space,Case Study
Available httpwwwspacecom10666nasasolarsailsatellitesuccesshtml,Case Study
The commonality among the three types is that they all use a propellant to thrust the rocket forward,Case Study
securities were 4396 billion at the end of the first quarter of 2018,Financial Reports
 a Cost Cost of Conventional Rockets Space travel has been generally perceived to be an expensive venture and it has been certainly true,Case Study
These orbiter shuttles are designed to land on the runway of the Kennedy Space Center gliding in its final moments as an unpowered glider,Case Study
Project ataglance Challenge Automating a complex timeconsuming veriﬁcation processes requiring a legacy application a document management system and a variety of corresponding business rules,Case Study
 A team of Amazonians  from research scientists and program managers to procurement specialists and software engineers  has moved from their normal day jobs to a dedicated team working to build incremental testing capacity,Financial Reports
This concept is wellillustrated by imagining a person rotating in order to swing around a long piece of string with a weight attached at the end of it,Case Study
This has substantially enhanced cash flow while freeing up resources to design innovative new sources of lighting,Case Study
These libraries encourage testing specific call sequences interactions and other internal behavior which we believe leads to fragile tests,Coding Guidelines
At Language School LS 27 participants attended the informative talk,Case Study
 FUTURE OF SPACE TRAVEL SPACE TRAVEL FOR THE MASSES HISTORY CURRENT STATUS PROBLEMS AND FUTURE DIRECTIONS By Bo Rim Seo Submitted in Partial Fulfillment of BS,Case Study
From its first flight in 1981 space shuttles have flown many different missions,Case Study
Available httpsciencenasagovsciencenewsscienceatnasa200316jan_sts107,Case Study
 14 have Bachelors degree and 7 have Masters degree,Case Study
These problems have been addressed by increasing the knowledge of the space environment and developing better ways to prepare and package foods,Case Study
Use TODO comments Use TODO comments for code that is temporary a shortterm solution or good enough but not perfect,Coding Guidelines
 Amazon is supporting small businesses by partnering with American Express and its Stand for Small initiative providing free use of business tools that help with virtual communication and collaboration such as Amazon Chime Amazon WorkDocs and Amazon WorkSpaces as well as enabling small businesses to use the cloud at no charge for 12 months with AWS Free Tier,Financial Reports
In the design of the space elevator this lifter would be the robotic platform with tractiontread rollers that would clamp on to the ribbon and pull the ribbon through,Case Study
The gas is held and regulated under a very high pressure by a valve or regulator,Case Study
 Engagement  Our community metrics including Facebook DAUs and MAUs and Family MAP and DAP reflect increased engagement as people around the world sheltered in place and used our products to connect with the people and organizations they care about,Financial Reports
Nitrocellulose is frequently used since it has both an oxidation and reduction capacity,Case Study
Undue reliance should not be placed on the forwardlooking statements in this press release which are based on information available to us on the date hereof,Financial Reports
Even the smallest movement could cause a wobble or a swing in the cable that the velocity of any spacecraft or object exiting the elevator would be either boosted or reduced,Case Study
They represent an intermediate group between solid and liquid propellant,Case Study
With Amazon AppFlow customers can bring together and manage petabytes even exabytes of data spread across all of their applications without having to develop custom connectors or manage underlying API and network connectivity,Financial Reports
Available httpezinearticlescomTheCapitalistSpaceRaceLettheBestBeginid1721410,Case Study
European nations also joined in this international trend by creating a European Space Agency ESA in the same year of 1975,Case Study
Sevenyearold Roraigh Curran of Chorley in northwestern England won a contest by London based Lost My Name books,Case Study
Beneﬁts Reduced costs and risks faster turnaround for veriﬁcation and fewer human errors,Case Study
 Alexa is helping customers stay informed and connected and can now answer tens of thousands of questions related to COVID19,Financial Reports
The company delivers legal solutions coupled with business and industry insight to help clients address their most complex business challenges,Case Study
The lifter will be powered by a freeelectron laser system located on or near the anchor station,Case Study
 Nonconstant field names Nonconstant field names static or otherwise are written in lowerCamelCase,Coding Guidelines
See the table captioned Reconciliation of nonGAAP results of operations to the nearest comparable GAAP measures for more details,Financial Reports
Exactly one toplevel class Exactly one blank line separates each section that is present,Case Study
Saturn V one of the largest rockets ever flown successfully took Apollo half way to the moon then launched it into the lunar trajectory,Case Study
 University of Nebraska Press 2008,Case Study
Forwardlooking statements This press release may contain forwardlooking statements that involve risks and uncertainties,Financial Reports
 Ring launched several new products and features including two Ring Video Doorbells and its next generation Ring Chime and Ring Chime Pro in the US the UK Canada Australia and New Zealand,Financial Reports
 The World Health Organization is using AWS to build largescale data lakes aggregate epidemiological country data rapidly translate medical training videos into different languages and help global healthcare workers better treat patients,Financial Reports
SpaceShipTwo was officially disclosed to the public in December 2009 in California and is tentatively scheduled start its operations in 201430,Case Study
We expect our business performance will be impacted by issues beyond our control including the duration and efficacy of shelterinplace orders the effectiveness of economic stimuli around the world and the fluctuations of currencies relative to the US dollar,Financial Reports
Every method you write public or otherwise would benefit from Javadoc,Coding Guidelines
 of participants got it right,Case Study
Our Whole Foods Market locations are open to seniors one hour before opening the store to the general public and we are reserving the first hour of grocery pickup at select Whole Foods Market locations for seniors,Financial Reports
Such risk taking pioneering spirits though at times costly ultimately helped us to thrive and progress,Case Study
Examples  Constants static final int NUMBER  5 static final ImmutableListString NAMES  ImmutableListofEd Ann static final ImmutableMapString Integer AGES  ImmutableMapofEd 35 Ann 32 static final Joiner COMMA_JOINER  Joineron  because Joiner is immutable static final SomeMutableType EMPTY_ARRAY   enum SomeEnum  ENUM_CONSTANT   Not constants static String nonFinal  nonfinal final String nonStatic  nonstatic static final SetString mutableCollection  new HashSetString static final ImmutableSetSomeMutableType mutableElements  ImmutableSetofmutable static final ImmutableMapString SomeMutableType mutableValues  ImmutableMapofEd mutableInstance Ann mutableInstance2 static final Logger logger  LoggergetLoggerMyClassgetName static final String nonEmptyArray  these can change These names are typically nouns or noun phrases,Coding Guidelines
This enables IDEs or other static analysis tools to issue a warning if any cases were missed,Coding Guidelines
With the development of the telescope in 1609 by Galileo Galilei people were able to see the universe in more detail and to find out the principles of the cosmos,Case Study
Reconciliation from net cash provided by operating activities to free cash flow in millions unaudited We provide free cash flow because it is a liquidity measure that provides useful information to management and investors about the amount of cash generated by the business that can be used for strategic opportunities including investing in our business and acquisitions and to strengthen our balance sheet,Financial Reports
 Origin Energy Australias largest integrated energy retailer is using Amazon Connect to operate its cloudbased contact center and successfully manage inbound calls by enabling their contact center agents to work remotely during the COVID19 crisis,Financial Reports
This would speed up the decision making which in turn would translate to a seamless experience for the agent and the end user,Case Study
Many times you dont need to catch the exception at this level anyway just let the method throw it,Coding Guidelines
Actual results may differ materially from the results predicted and reported results should not be considered as an indication of future performance,Financial Reports
If that should happen those programs are broken and they must be fixed,Case Study
The ticket sale was to fund the maintenance of the Mir space station however a premature deorbit decision diverted Titos destination to the ISS,Case Study
 Recommended if any word already has a conventional camelcase appearance in common usage split this into its constituent parts eg AdWords becomes ad words,Coding Guidelines
Nevertheless when and if the necessary 100 GPa is reached by the advancement of technology the process of constructing the space elevator has been estimated to take up to 2 years from that time7,Case Study
Now lowercase everything including acronyms then uppercase only the first character of   each word to yield upper camel case or   each word except the first to yield lower camel case 4,Coding Guidelines
 of participants got it right,Case Study
Another launch accident this one from Cape Canaveral in June destroyed a set of science experiments meant to supplement the stories,Case Study
Instead local variables are declared close to the point they are first used within reason to minimize their scope,Case Study
Therefore research projects such as SOFBALL2 have attempted to light up some flame balls measure their properties and hopefully replicate the fuel saving effect on energy saving cars on earth64,Case Study
 J Kelly Debris is Shuttles Biggest Threat Spacecom 05Mar2005,Case Study
The soontobespace bound book shows satellite views of Roraighs hometown even his street and house and stars in the sky spell out his nameRoraighs favorite part,Case Study
 serverPort will just be unchanged ,Coding Guidelines
To integrate CalWIN with Documentum required signiﬁcant code changes to CalWIN but being a legacy application code changes to CalWIN were really not an option,Case Study
Each Unicode code point counts as one character even if its display width is greater or less,Case Study
Each booster contains 500000 kg of propellant and can produce up to 14680000 Newtons of thrust force51,Case Study
 In the medical field artificial pacemakers designed to control the patients heartbeat from irregularities caused by cardiac conditions are applications of the machinery that controlled the engine pump of a rocket,Case Study
 This guidance assumes among other things that no additional business acquisitions investments restructurings or legal settlements are concluded,Financial Reports
Monday August 27 2013 200 pm Light refreshments and snacks will be provided,Case Study
Available httpwwwieeeghnorgwikiindexphpMilestonesGrumman_Lunar_Module,Case Study
A The averages scale from the respondents was 363 and Standard deviation was 126,Case Study
Among these oxidizers liquid fluorine produces the highest specific impulse,Case Study
Available httpsailquarkwebcomlighthtm,Case Study
Customer accounts exclude certain customers including customers associated with certain of our acquisitions Amazon Payments customers AWS customers and the customers of select companies with whom we have a technology alliance or marketing and promotional relationship,Financial Reports
The presentation of this financial information is not intended to be considered in isolation or as a substitute for or superior to the financial information prepared and presented in accordance with GAAP,Financial Reports
First success was seen in June 2010 when Japans Ikaros probe ejected its solar sail spacecraft to sail through space propelled only by sunlight,Case Study
Problems with conventional rockets Recent exciting developments in the field a Elon Musk and SpaceX b,Case Study
 Operating income decreased to 40 billion in the first quarter compared with operating income of 44 billion in first quarter 2019,Financial Reports
If the value must be used outside of the try block then it must be declared before the try block where it cant yet be sensibly initialized  Instantiate class cl which represents some sort of Set Set s  null try  s  Set clnewInstance  catchIllegalAccessException e  throw new IllegalArgumentExceptioncl   not accessible  catchInstantiationException e  throw new IllegalArgumentExceptioncl   not instantiable   Exercise the set saddAllArraysasListargs However you can even avoid this case by encapsulating the trycatch block in a method Set createSetClass cl   Instantiate class cl which represents some sort of Set try  return Set clnewInstance  catchIllegalAccessException e  throw new IllegalArgumentExceptioncl   not accessible  catchInstantiationException e  throw new IllegalArgumentExceptioncl   not instantiable     Exercise the set Set s  createSetcl saddAllArraysasListargs Declare loop variables in the for statement itself unless theres a compelling reason to do otherwise for int i  0 i  n i  doSomethingi  and for Iterator i  citerator ihasNext   doSomethingElseinext  Order import statements The ordering of import statements is 1,Coding Guidelines
 F Howard Wilbur and Orville a biography of the Wright brothers,Case Study
Note this is not the same as the import statements being in ASCII sort order since ,Case Study
The propellant is held together by a polymeric binder usually polyurethane or polybutadienes which is also consumed as fuel,Case Study
On March 11th 2008 Japanese Experiment Module called Kibo was launched for the first time in Asia,Case Study
The live webcast of Facebooks earnings conference call can be accessed at investorfbcom along with the earnings press release financial tables and slide presentation,Financial Reports
These critiques have to do with the dangerous vibrations caused by the natural resonant frequency of the cable the wobble and whipping action caused by gravitational pulls of the sun and the moons well as solar wind possible impact with asteroids and space junk possible terrorist attacks and impracticality of constant preventative surveillance system61,Case Study
The main advantage of is that they have high performance and can be moderated stopped or even restarted,Case Study
As mentioned in a previous section among the most problematic objects in orbit are space junk comprised of pieces such as nonfunctional space crafts abandoned launch vehicle stages missionrelated debris and fragmentation debris35 39,Case Study
Were not going to let them down,Financial Reports
___ The heart pump that doctors use for heart surgery was originally designed as rocket fuel pump,Case Study
All nonstatic imports in a single block,Case Study
A conference call will be webcast live today at 230 pm PT530 pm,Financial Reports
With sails that were too heavy the design and launch of a solar sailing vehicle was impractical,Case Study
This paper examined and analyzed these problems in depth and posits the problem of propulsion as the central issue to target,Case Study
Conclusion Space travel has had a relatively short history beginning from the 1960s,Case Study
In the solar sailpowered spacecraft both the rocket fuel and engine are replaced with sails that are powered by the suns constant pressure of photons,Case Study
 Programming Practices 61 Override always used A method is marked with the Override annotation whenever it is legal,Coding Guidelines
Military rockets eventually increased in size and performance with continual refinement of the technology,Case Study
From online shopping to AWS to Prime Video and Fire TV the current crisis is demonstrating the adaptability and durability of Amazons business as never before but its also the hardest time weve ever faced said Jeff Bezos Amazon founder and CEO,Financial Reports
  15  NonGAAP constant currency revenues and growth We define nonGAAP constant currency revenues as total revenues excluding the effect of foreign exchange rate movements and hedging activities and we use it to determine the constant currency revenue growth on yearonyear and quarteronquarter basis,Financial Reports
On April 24th 1990 the Hubble Space Telescope one of the largest space telescope built by the US space agency NASA and European Space Agency ESA was launched by the Space Shuttle Discovery,Case Study
The participants were of a homogeneous racial group from South Korea except for four younger participants who were considered KoreanAmerican,Case Study
Its 95000 ticket includes preflight training sessions and is scheduled to start providing flights by 2014,Case Study
Based on the forms the agent was using for each case certain combinations of ﬁelds needed to be veriﬁed,Case Study
The storyOne of ﬁve major San Diego County government divisions the Health and Human Services Agency oers the community a wide range of health and social programs including aging and independence services public health programs and childrens services,Case Study
When the block ends the indent returns to the previous indent level,Case Study
For example if he was using Form A and Form B then social security and address ﬁelds needed to be veriﬁed in the supporting documents whereas if he was using Form C and Form B then social security and drivers license details needed to be veriﬁed,Case Study
Therefore this continuous force from sunlight will give constant acceleration to the space craft,Case Study
Once the domain of governments space travel is now also in the private sector,Case Study
When the drop in air pressure does not go to a lethally low level the dysbarism occurs as the nitrogen in the blood bubbles throughout the circulatory system,Case Study
San Diego County chose Automation Anywhere to automate its extremely complex Health and Human Services processing and veriﬁcation functions,Case Study
_F_ Taking vacations to space will be too costly even in the future,Case Study
During the 10 million Ansari X Prize challenge private companies competed with each other to launch a reusable manned spacecraft twice within two weeks27,Case Study
Providing for customers and protecting employees as this crisis continues for more months is going to take skill humility invention and money,Financial Reports
The 7yearold won a contest by Londonbased Lost My Name books with the prize of a personalized version of The Incredible Intergalactic Journey Home sent to the space station in December 2015 for a reading,Case Study
In most cases you shouldnt be handling different types of exceptions in the same way,Coding Guidelines
