text,intent
Problems with Conventional Propulsions and Alternative Solutions A,Case Study
Already more than 17 billion investments have occurred in private space flight industry by companies like Google and that is only half of what is being committed and planned for the next few years,Case Study
The beneﬁts of automating these systems A noninvasive solution reduced costs and risk,Case Study
Moreover it was able to generate 10 times the power of the conventional rocket engines,Case Study
If that code uses spaces around the if clauses you should too,Coding Guidelines
High School or equivalent diploma C Some college Associates Degree etc,Case Study
 Special escape sequences For any character that has a special escape sequence b t n f r   and  that sequence is used rather than the corresponding octal eg,Case Study
On April 1st 1960 the US launched the first weather satellite Tiros 1,Case Study
If your TODO is of the form At a future date do something make sure that you either include a specific date Fix by November 2005 or a specific event Remove this code after all production mixers understand protocol V7,Coding Guidelines
In their Grasshopper Test Project engineers at Space X have been testing vertical landing for the terminal portion of the flight by enabling the rocket to adjust its angle the pitch and yaw of the main engine and to maintain roll with coal gas thrusters,Case Study
Test classes are named starting with the name of the class they are testing and ending with Test,Coding Guidelines
Additional IDE configuration When using IntelliJ to develop Presto we recommend starting with all of the default inspections with some modifications,Coding Guidelines
This 30 minute presentation will include multimedia and lively discussions,Case Study
 Staff Human Space Flight 2020 vision The Economist 14Nov2002,Case Study
 Weve implemented additional safety measures within our Whole Foods Market stores including providing plexiglass barriers between cashiers and customers at checkout rolling out enhanced cleanliness and sanitation protocols and enforcing social distancing guidelines,Financial Reports
It obscures the failure handling properties of your code meaning if someone adds a new type of exception in the code youre calling the compiler wont point out that you need to handle the error differently,Coding Guidelines
In addition we have committed over 300 million to date in investments to help our broader community during the crisis which will have an impact on our financial performance this year,Financial Reports
 C Moscowitz 40 Years After Moon Landing Why Is It So Hard to Go Back 20Jul2009,Case Study
Composite propellants consist of heterogeneous powders or mixtures,Case Study
However Virgin Galactic is definitely not alone in its venture into space tourism as it is being seen as lucrative industry for the upcoming many decades2 12 13,Case Study
However hypergols are highly toxic and must be handled exceptionally carefully,Case Study
___ In the future regular people will be able to go into space,Case Study
 In a chain of modules other than at the VERBOSE level when a lowerlevel module detects invalid data coming from a higherlevel module the lowerlevel module should only log this situation to the DEBUG log and only if logging provides information that isnt otherwise available to the caller,Coding Guidelines
A 20 said yes 588 3 said no 88 5 said they were not sure 324,Case Study
This can be achieved by sustaining same surface area throughout the burn,Case Study
Among its protection system the most important is the thermal protection system to protect the shuttle from intensive heat during the reentering of the Earths atmosphere,Case Study
A WhiteCaucasian B BlackAfrican Descent C LatinoLatina D East Asian E Southeast Asian F Middle eastern Asian G Native American H Biracial I,Case Study
Currently Virgin Galactic remains as the only private space tourism company that successfully airlaunched its SpaceShipTwo vehicle12,Case Study
Visit us at wwwautomationanywherecom today,Case Study
However several private companies are developing suborbital space vehicles to commercialize space travel which would take passengers to an altitude of 100 km 62 miles27,Case Study
He discovered the concept of exhaust velocity which means that the greater the explosion of the fuel the greater the thrust velocity,Case Study
 2015 The Associated Press,Case Study
Prior period amounts were not retrospectively adjusted,Financial Reports
However the concerns proved to be unfounded as no delays were experienced28,Case Study
Q Was this talk hard to understand in English,Case Study
 of participants got it right,Case Study
 Were working hard to increase order capacity for Prime Now Amazon Fresh and Whole Foods Market,Financial Reports
A There were 7 WhiteCaucasian 8 LatinoLatina 18 East Asian 1 Southeast Asian and 3 Middle Eastern Asians,Case Study
 of participants got it right,Case Study
More information about factors that potentially could affect Amazoncoms financial results is included in Amazoncoms filings with the Securities and Exchange Commission SEC including its most recent Annual Report on Form 10K and subsequent filings,Financial Reports
Homogeneous propellants are relatively weak,Case Study
The addition of a dampening system to the cable however poses similar complications as adding thrusters for addressing the issue of violent shaking61,Case Study
Solid rockets were invented much before liquid propellant rockets and this includes the ancient firework rockets that were used in wars long ago,Case Study
 R Netting Science that Cant be Done on Earth NASA Science News,Case Study
There are two different types of solid propellants namely homogeneous and composite51,Case Study
Put static imports above all the other imports ordered the same way as regular imports,Coding Guidelines
These sails are about onefourth the thickness of a plastic trash bag,Case Study
On October 1st 1958 the National Aeronautics and Space Administration NASA was founded,Case Study
Globally Amazon has 86 renewable energy projects that have the capacity to generate over 2300 MW and deliver more than 63 million MWh of energy annually,Financial Reports
 Dont catch generic exceptions It can be tempting to be lazy when catching exceptions and do something like this try  someComplicatedIOFunction  may throw IOException someComplicatedParsingFunction  may throw ParsingException someComplicatedSecurityFunction  may throw SecurityException  phew made it all the way  catch Exception e   Ill just catch all exceptions handleError  with one generic handler ,Coding Guidelines
SOLUTION Husch Blackwell talked with different companies about how they managed their bots before running its own proofofconcept POC scenarios,Case Study
As for the force of this nudge it is true that the force on a solarsail spacecraft is far less than a conventional chemical rocket like the space shuttle,Case Study
In VASIMAR natural gas is converted into plasma or very hot partially ionized gas by high power radiowaves within a chamber17,Case Study
 Class names Class names are written in UpperCamelCase,Coding Guidelines
Besides this main goal NASA sent probes to explore the earths space environment the moon and other planets as well as the sun and stars16,Case Study
The participation of young elementary school children in the second group may have helped the rest of members of the group to hear more fundamental answers from the basic questions asked which might have affected the result,Case Study
 of participants got it right,Case Study
In liquid propellant rockets the fuel and oxidizer must be stored separately in two separate tanks made of metal since many liquid fuels catch fire and burn upon contact52,Case Study
Customers are considered active when they have placed an order during the preceding twelvemonth period,Financial Reports
If your debug logs are dominating the log then you should use verbose logging,Coding Guidelines
 The imports that people want to look at least tend to be at the bottom java,Coding Guidelines
Part C Comments on Presentation Q Did the talk help you to consider space travel,Case Study
No additional resources were required for custom programming,Case Study
Therefore there must be no active logic in an if LOCAL_LOG block,Coding Guidelines
The shuttles missions included deploying satellites capturing them in orbit for repair and returning them to earth leading many scientific experiments such as the study of how weightlessness affects living organisms and becoming observational sites for studying the heavenly bodies of the universe,Case Study
 if a typical reader may have no idea what the term canonical name means,Coding Guidelines
Available httpsciencehowstuffworkscom10majorplayersinprivatesectorspace racehtm,Case Study
And what if the Earths magnetic field could be augmented,Case Study
ISS was created as a merger of three space station projects in 1993 with components for Russian Mir2 American Freedom European Columbus space station programs,Case Study
Additional information will also be set forth in our Quarterly Report on Form 10Q for the quarter ended March 31 2020,Financial Reports
From then on climbers would be sent up to the satellite to create a stronger ribbon by adding strands of new carbon nanotube cable to the existing one,Case Study
As mentioned previously NASA has therefore put in measures to prevent detrimental losses of skills and talent in its workforce,Case Study
Spacerelated tourism experiences Lubin 2012 b Costreducing Reusable Chemical Rockets Fortunately there are many surprising ways to cut down the cost of building a rocket while still remaining in the conventional realm meaning that conventional liquid and solid fuels are used for thrust,Case Study
When a line is broken at a nonassignment operator the break comes before the symbol,Case Study
No additional resources were required for custom programming,Case Study
The competition between Soviet Union and United States on striving to reach the moon first was a fierce one,Case Study
The next challenge for the aeronautical community was forging an international collaboration leaving behind the era of international competition between the US and the Soviet Union,Case Study
Possible alternative sources for rocket propulsion i,Case Study
Beneﬁts Reduced costs and risks faster turnaround for veriﬁcation and fewer human errors,Case Study
Despite its recency the field has seen rapid development over the last several decades,Case Study
Exciting developments in space tourism does not end there,Case Study
The mass of the platform will also ensure that the center of mass of the system stays sufficiently above the earth7 60,Case Study
Onboard crafts that produce electricity from solar panels eg,Case Study
Divide this result into words splitting on spaces and any remaining punctuation typically hyphens,Coding Guidelines
 of participants got it right,Case Study
Alcohols were used during the early years of rocketry,Case Study
The potential risks and uncertainties that could cause actual results to differ from the results predicted include among others those risks and uncertainties included under the captions Risk Factors and Managements Discussion and Analysis of Financial Condition and Results of Operations in our Annual Report on Form 10K for the year ended December 31 2019 which is on file with the SEC and is available on our investor relations website at httpabcxyzinvestor and on the SEC website at wwwsecgov,Financial Reports
Despite the concerns over the negative health effects of weightlessness Gagarin returned unharmed and functioned normally,Case Study
An integration challengeDigitizing supporting documents and using CalWIN had introduced a challenge How to get the two programs to communicate with each other automatically,Case Study
_____________________ What is your primary language,Case Study
A lot technology developed for space travel are what we use today ii,Case Study
In 1998 a spacecraft called Deep Space 1 was sent with ionthrusters where ionized xenon gas was used as propellant,Case Study
We are taking a broader view of our responsibility and investing to make sure our services are used for good,Financial Reports
During the ignition of an explosive fuel hot and expanding gasses are created to produce thrust,Case Study
For example these names are not Google Style name_ mName s_name and kName,Coding Guidelines
They succeed in taking energy from solar cells and beaming it to the Big Island of Hawaii 92 miles from Maui after converting it to microwaves and gained 20 watts worth of electricity57,Case Study
Such a condition should only be logged by a module that believes that its the most authoritative in that domain to avoid duplicate logging by nonauthoritative components,Coding Guidelines
Additional information will also be set forth in our Quarterly Report on Form 10Q for the quarter ended March 31 2020,Financial Reports
 Import statements 331 No wildcard imports Wildcard imports static or otherwise are not used,Case Study
 Braces 411 Braces are used where optional Braces are used with if else for do and while statements even when the body is empty or contains only a single statement,Case Study
 Public static final fields constants are ALL_CAPS_WITH_UNDERSCORES,Coding Guidelines
During the presurveys participants were asked to rate their interest in space travel for 6 items on a scale of 1 to 5 with 1 being Not at all  and 5 being Very much In addition 14 trueandfalse questions were asked to assess their background knowledge of space travel as well as their attitudes toward it,Case Study
In terms of their classification composite propellants are classified or defined by the type of polymeric binder used,Case Study
Quarter Ended March 31 2020 QoQ using Q419s FX rates  12845 EMEA revenues GAAP Exclude foreign exchange effect on Q120 revenues using Q119 rates Exclude foreign exchange effect on Q120 revenues using Q419 rates EMEA constant currency revenues nonGAAP Prior period EMEA revenues GAAP EMEA revenue growth GAAP EMEA constant currency revenue growth nonGAAP APAC revenues GAAP Exclude foreign exchange effect on Q120 revenues using Q119 rates Exclude foreign exchange effect on Q120 revenues using Q419 rates APAC constant currency revenues nonGAAP Prior period APAC revenues GAAP APAC revenue growth GAAP APAC constant currency revenue growth nonGAAP Other Americas revenues GAAP Exclude foreign exchange effect on Q120 revenues using Q119 rates Exclude foreign exchange effect on Q120 revenues using Q419 rates Other Americas constant currency revenues nonGAAP Prior period Other Americas revenues GAAP Other Americas revenue growth GAAP Other Americas constant currency revenue growth nonGAAP United States revenues GAAP United States revenue growth GAAP YoY using Q119s FX rates  12845 235              NA 13080 11668 10  12  7238 61 NA 7299 6096 19  20  2157 96 NA 2253 1906 13  18  18870 14  49 41159 41502 36202              NA 63 12782 14099 9 9 7238 NA 37 7275 7482 3 3 2157 NA 14 2171 2666 19 19 18870 13 49 41159 41098 45984 Hedging gains Revenues GAAP Constant currency revenues nonGAAP Prior period revenues excluding hedging effect nonGAAP1 Revenue growth GAAP Constant currency revenue growth nonGAAP 1 11 11 Total revenues and hedging gains for the quarter ended March 31 2019 were 36339 million and 137 million respectively,Financial Reports
Mankins team also assembled to find out in mid 1990s whether advances in technology would make spacebased solar power more feasible,Case Study
These innovations most of them not patented ultimately all advance the concept making rockets reusable7,Case Study
 You may obtain a copy of the License at   httpwwwapacheorglicensesLICENSE20   Unless required by applicable law or agreed to in writing software  distributed under the License is distributed on an AS IS BASIS  WITHOUT WARRANTIES OR CONDITIONS OF ANY KIND either express or implied,Coding Guidelines
AP PhotoDmitry Lovetsky File An English schoolboy will vicariously travel along as well,Case Study
Imports from third parties com junit net org java and javax To exactly match the IDE settings the imports should be  Alphabetical within each grouping with capital letters before lower case letters for example Z before a  Separated by a blank line between each major grouping android com junit net org java javax Originally there was no style requirement on the ordering meaning IDEs were either always changing the ordering or IDE developers had to disable the automatic import management features and manually maintain the imports,Coding Guidelines
In 2005 the 100 kgCosmos 1 was launched from the Volna rocket from a Russian submarine in the Barents Sea,Case Study
PreSurvey and refreshments Overview and Purpose of this presentation a,Case Study
Also liquid hydrogen has a very low density of 0071 gml which requires a large storage volume in turn,Case Study
When one of the firms managing attorneys expressed interest in getting information about potential litigation quicker the RPA team figured out a way to use a bot to scan a daily email the company received and highlight potential litigation,Case Study
Constants are static final fields whose contents are deeply immutable and whose methods have no detectable side effects,Coding Guidelines
 D Leonard Secretive Blue Origin Reveals New Details of Spacecraft Plans Spacecom 04May 2012,Case Study
Sometimes if you only need to append something consider using the  operator,Coding Guidelines
Customer Accounts Amazoncom Inc Certain Definitions  References to customers mean customer accounts established when a customer places an order through one of our stores,Financial Reports
In general alphabetize methodsvariablessections if such ordering already exists in the surrounding code,Coding Guidelines
Part B Scientific Knowledge or Experience _F_ Human space travel is only for trained astronauts and fictional characters in SciFi movies,Case Study
On April 29th 2012 the Virgin Galatics SpaceShipTwo a private spaceship in the US designed to carry space tourists made its successful first rocketpowered test flight reaching supersonic speeds,Case Study
Circle one Beginner Intermediate Advanced FluentNative Was this talk hard to understand in English,Case Study
In 2001 the first commercial human space flight took place Dennis Tito travelled to the International Space Station in exchange for providing funds to NASA,Case Study
These hightouch repetitive processes like reconciliations cash application payment validation and report generation were very laborintensive,Case Study
 Automation Anywhere made it possible to integrate a legacy system with Documentum without requiring any changes to the legacy system,Case Study
 2 How adventurous are you,Case Study
 M Hanlon Exoskeletons Wearable Robots Online,Case Study
A The averages scale from the respondents was 347 and Standard deviation was 137,Case Study
If value is not a valid number die,Coding Guidelines
The Concord jet had doubled the speed of commercial airplanes but since its retirement the new airliners being currently manufactured are again the same speed as the DC8 planes in 1958,Case Study
The column limit Section 44 Column limit 100 does not apply to package statements,Case Study
We leverage our retail infrastructure to offer a wide selection of consumable and durable goods that includes media products available in both a physical and digital format such as books music videos games and software,Financial Reports
 Potentially reduces the number of import statements,Coding Guidelines
NASA estimates that it has had to conduct around one collision avoidance maneuver per year for its shuttles and ISS,Case Study
Hence while an average American uses about 132 liters of water per day the astronauts onboard the ISS must limit their water use to about 11 liters per day43,Case Study
 Annotations Annotations applying to a class method or constructor appear immediately after the documentation block and each annotation is listed on a line of its own that is one annotation per line,Coding Guidelines
For example exercise machines in gyms and sports centers were originally designed for the astronauts in space to prevent longterm weakening of their muscles and bones,Case Study
This rotating motion of the weight will cause the centrifugal force to be directed radially outward from the center which will keep the string taut,Case Study
The ESA participated in many solar system missions with a large budget reaching 31 billion US dollars in 200321,Case Study
Project ataglance Challenge Automating a complex timeconsuming veriﬁcation processes requiring a legacy application a document management system and a variety of corresponding business rules,Case Study
This level is always logged,Coding Guidelines
As a reference that is about the same percent risk that the typical American encounters during ones lifetime dying in an ordinary traffic accident24,Case Study
Infosys BPM has been providing Finance and Accounting services to Signify since 2007,Case Study
Imagine having to refuel on liquid hydrogen or whatever fuel out on Mars and how costly that would be,Case Study
Among those participants the presurvey was completed by 25 participants and postsurvey by 22 participants,Case Study
Purchases of property and equipment,Financial Reports
 Exception A blank line between two consecutive fields having no other code between them is optional,Case Study
The live webcast of Facebooks earnings conference call can be accessed at investorfbcom along with the earnings press release financial tables and slide presentation,Financial Reports
Seamless execution on 2000 computers  SMART Automation Technology The agents all use dierent computer conﬁgurations  so any solution would have to adjust to several parameters like screen sizes and resolutions operating systems and dierent platforms including Citrix and then run the automated tasks seamlessly on each computer,Case Study
___ Space exploration has been just a political show for big countries and has not brought any benefit to society,Case Study
 C Gainor To a Distant Day The Rocket Pioneers,Case Study
Circle one Yes No IF YES approximately what percent of the talk did you understand,Case Study
One typical pattern is methodUnderTest_state for example pop_emptyStack,Coding Guidelines
Tip Never make your code less readable simply out of fear that some programs might not handle nonASCII characters properly,Case Study
 Arrays 4831 Array initializers can be blocklike Any array initializer may optionally be formatted as if it were a blocklike construct,Case Study
However many hurdles still stand in the way of making space travel a reality for the everyman,Case Study
As required by other sections of this document such as Section 3 Source file structure and Section 33 Import statements,Case Study
There are no specific rules or even wellestablished conventions for naming annotation types,Coding Guidelines
The firm has 13 ideas in the automation pipeline and its RPA team meets regularly to discuss which ideas have merit and the highest return on investment,Case Study
Moreover the Korean culture of learning may have helped the CC group to focus during the presentation and learn more,Case Study
The new space suits in development improves on these limitations by providing the regular atmospheric air pressure in rigid exoskeletons with flexible joints41,Case Study
Available httpinventorsaboutcomodrstartinventionsaSolidPropellant_2htm,Case Study
Note Some words are ambiguously hyphenated in the English language for example nonempty and nonempty are both correct so the method names checkNonempty and checkNonEmpty are likewise both correct,Coding Guidelines
Finally join all the words into a single identifier,Coding Guidelines
Space Elevator  44 Other Considerations  50 A,Case Study
Likewise in space travel the 1964 Grumman Apollo Lunar Module was a superb craft designed to fly only in space which could land on and take off from the moon without requiring much maintenance6,Case Study
We made over 150 significant process changes in our operations network and Whole Foods Market stores to help teams stay healthy  and we conduct daily audits of the measures weve put into place,Financial Reports
For a simple base propellant a single compound is used,Case Study
Temperature control is also critical as overheating would cause heatrelated illnesses and death eg,Case Study
When working with such code its okay to continue the existing style,Coding Guidelines
Categorize errors when throwing exceptions,Coding Guidelines
Not only that more excitements are now on the horizon such as settlement on the moon colonization of Mars and intergalactic travel2 11,Case Study
_T_ Several private companies have successfully built and sent powerful rockets into space,Case Study
Tsiolkovsky wrote many articles about the principles and theoretical aspects of spaceflight,Case Study
For example the following are all valid not an exhaustive list new int  new int  0 1 2 3 0  1 2 new int  3 0 1  2 3  new int 0 1 2 3 4832 No Cstyle array declarations The square brackets form a part of the type not the variable String args not String args,Case Study
Thus it is necessary to find some ways to store the energy to use in times and places where no sunlight is provided yet not one found the way to do this in a large scale,Case Study
In revisiting the counterweight its necessity is indubitable given that it will work against the Earths gravitational force to keep the cable taut,Case Study
Once the domain of governments space travel is now also in the private sector,Case Study
Supporting documents used to qualify every individual for various government assistance programs like food stamps the Supplemental Nutrition Program Temporary Assistance for Needy Families Medical and more were being transferred onto a digital format using EMC Documentum,Case Study
