text,intent
First Quarter 2018 Financial Highlights Three Months Ended March 31 2018 2017 11795 171 11966 6517 5449   46  622 11    4988 169      7857 175 8032 4705 3327 50  2  49  39  64  Change YearoverYear  41  63  63  3064 104 In millions except percentages and per share amounts Revenue Advertising Payments and other fees Total revenue Total costs and expenses Income from operations Operating margin Provision for income taxes Effective tax rate Net income Diluted Earnings per Share EPS First Quarter 2018 Operational and Other Financial Highlights overyear,Financial Reports
Supported by a 22 million grant from NASA New Shepard boasts its innovative biconic shape that provides greater crossrange and interior volume than traditional capsules without the weight penalty of winged spacecraft p 132 In addition the spacecraft features a pusher escape system that allows the crew to escape in an emergency situation during any phase of ascent into suborbital flight,Case Study
Working with a legacy application  a noninvasive approach is really the only way Automation Anywheres inhouse experts sat down to design a process that would serve SDCs requirements,Case Study
Few participants gave negative answers to the abovementioned evaluative questions 4 out of 34 participants responded no for the first 3 questions 117 and 3 out of 34 participants gave a negative response to the last question 882,Case Study
It has been found that the brain adapts to weightlessness and therefore directionlessness by building a mental model that could guide the body in making sense of the unusual experiences,Case Study
CalWIN supported over 500 dierent forms,Case Study
San Diego County  Health and Human Services AgencyAn Automation Anywhere Case Study,Case Study
How large of the fuels explosive power is and how fast combustion takes place regulate the specific impulse,Case Study
We are also matching 20 million in donations to support COVID19 relief efforts providing health organizations with free ads and tools to track the pandemic offering Workplace to government and emergency organizations for free and donating 25 million to support healthcare workers on the front lines,Financial Reports
 Staff Space Tourists Could Fly by 2013 BBC 26Oct2011,Case Study
CalWIN supported over 500 dierent forms,Case Study
Each statement group consists of one or more switch labels either case FOO or default followed by one or more statements or for the last statement group zero or more statements,Case Study
In General Relativity the gravitational field is explained through curved space and the curvature of space is important,Case Study
 Linewrapping Terminology Note When code that might otherwise legally occupy a single line is divided into multiple lines this activity is called linewrapping,Case Study
Log only whats needed to gather enough information about whats going on with your component,Coding Guidelines
With Amazon Keyspaces customers can easily migrate onpremises Cassandra workloads to the cloud without having to provision configure and operate servers or large Cassandra clusters or needing to manually add or remove nodes or rebalance partitions as traffic scales up or down,Financial Reports
 Amazon introduced a new speaking style for Alexa skills enabling US developers to build more natural longform content experiences by adding conversational pauses to Alexas speech when reading articles or blogs,Financial Reports
 Source file basics 21 File name The source file name consists of the casesensitive name of the toplevel class it contains of which there is exactly one plus the java extension,Case Study
Solution A noninvasive automation process utilizing the frontend of both applications and a system that completed all veriﬁcation requirements with the press of a single hotkey,Case Study
Using Earths Magnetism as Energy Resource Throughout history no one has used the Earths magnetism as the source for propulsion,Case Study
We also doubled the regular hourly base pay for overtime hours worked  a minimum of 34 an hour in the US  an increase from time and a half,Financial Reports
 of participants got it right,Case Study
As previously mentioned specific impulse also determines rocket performance by controlling internal thrust production through pressure and heat,Case Study
The column limit Section 44 Column limit 100 does not apply to import statements,Case Study
As of 2013 he last recorded space casualty occurred in 2003 with the space shuttle Columbia which disintegrated with its 7 crew members while reentering the Earth after a 2week mission due to structural failures after encountering problems in its thermal protection system23,Case Study
Thus they cannot be used in military rockets since they must be kept for months to be ready for launch at any time,Case Study
Supplemental Financial Information and Business Metrics in millions except employee data unaudited Net Sales Online stores 1 Online stores  YY growth excluding FX Physical stores 2 Physical stores  YY growth excluding FX Thirdparty seller services 3 Thirdparty seller services  YY growth excluding FX Subscription services 4 Subscription services  YY growth excluding FX AWS AWS  YY growth excluding FX Other 5 Other  YY growth excluding FX 6 Stockbased Compensation Expense Cost of sales Fulfillment Technology and content Marketing General and administrative Total stockbased compensation expense Other WW shipping costs WW shipping costs  YY growth WW paid units  YY growth 7 WW seller unit mix   of WW paid units 7 Employees fulltime and parttime excludes contractors  temporary personnel Employees fulltime and parttime excludes contractors  temporary personnel  YY growth ________________________ Q4 2018 Q1 2019 Q2 2019 Q3 2019 Q4 2019 Q1 2020 YY  Change 12 4307  1 16  4330  1  22  4192  1 15  4363  1 14  4401  3  39822  29498  31053  35039  45657  36652 25  4640 8   13383  11141  11962  13212  17446  14479 31  5556 29  9954  10219 33  3906 44  28  3959  26  7430  46  3388  97  28  4957  35  8995  35  3586  45  23 4342  42 7696  42 2716  36 25  4676  39  8381  37  3002  37  31  5235  32  34  4782  41             21  287  750  217  142  1417  9041  23  14  52  647500 24  234  675  209  132  1274  7320  21 10 53 630600 43  360  1077  307  184  1971  8134  36  18  54  653300 39  301  966  298  175  1779  43  286  1007  322  182  1840  41 260 961 332 163 1757 9608  12884  10936 49  32  52  840400 46  22  53  43  22  53  798000 750000 14  12 13  22  23  33  24 NA 8 NA 30 NA 28 NA 33 NA 44 NA 71 11 59 42 24 38 49 NA NA NA 33 NA 1 2 3 4 Includes product sales and digital media content where we record revenue gross,Financial Reports
Finally superstring theory suggests string as the fundamental element of the spacetime continuum which is presented as the threads of fabric,Case Study
The indent level applies to both code and comments throughout the block,Case Study
Dont ignore exceptions It can be tempting to write code that ignores an exception such as void setServerPortString value  try  serverPort  IntegerparseIntvalue  catch NumberFormatException e    Dont do this,Coding Guidelines
I am one of the first ones to go and buy a new gadget like iPhone,Case Study
We undertake no duty to update this information unless required by law,Financial Reports
Our investment in increased pay for our hourly employees and partners during COVID19 will be nearly 700 million through May 16,Financial Reports
It can overcome the speed of the conventional space propulsion systems that are very limited and requires lots of fuels and cost,Case Study
These varied innovations were able to come out of microgravity research because the experiments done in ISS are not limited to rocket science or astrophysics,Case Study
Departing from the use of gunpowder in ancient times modern solid fueled rockets use more powerful fuels49,Case Study
The stores checkoutfree experience is enabled by the same Just Walk Out Technology used in 25 Amazon Go stores across the US,Financial Reports
Alternatively the Marshall Space Flight Center supports a rigid lightweight carbon fiber material that is 200 times thicker than todays standard solar sail but weighs about the same as the thinnest materials being tested due to its thousands of tiny holes17 56,Case Study
In almost all cases its inappropriate to catch generic Exception or Throwable preferably not Throwable because it includes Error exceptions,Coding Guidelines
The talk will cover brief history of space travel the reasons for lack of progress in the last few decades and some recent exciting developments in the field,Case Study
For a 3year round trip to Mars thousands of kilograms of food would then be needed a crew of four will need to carry 10886 kg of food with them to space42,Case Study
Transcripts of conference calls with publishing equity research analysts held today will also be posted to the investorfbcom website,Financial Reports
This new generation of spaceships was called Voskhod and it became the first multi person spacecraft carrying 3 cosmonauts crammed into the cabin designed for one,Case Study
As long as the superconductor is kept below its critical cold temperature through insulation and other modes of temperature control it will stay locked in midair on top of a regular magnet,Case Study
As part of the prize he has been invited to the 2  3 APA citation Story Time from Space Astronauts getting new picture books 2015 October 26 retrieved 21 October 2020 from httpsphysorgnews201510storyspaceastronautspicturehtml This document is subject to copyright,Case Study
This sentence should start with a third person descriptive verb,Coding Guidelines
 When used on String objects the  operator implicitly creates a StringBuilder instance with the default buffer size 16 characters and potentially other temporary String objects,Coding Guidelines
Moreover advances in building rockets with significantly lighter but stronger material would further decrease the costs for spaceflight as it would make its energy use as efficient as possible11,Case Study
 package comandroidinternalfoo import androidosBlah import androidviewYada import javasqlResultSet import javasqlSQLException   Does X and Y and provides an abstraction for Z,Coding Guidelines
Once operational the lifters could be climbing the space elevator nearly every day,Case Study
C 1 a Problems Limitations and Possible Solutions Safety and Convenience Space Junk One of the major safety concerns for space travel perhaps surprisingly has to do with the space debris that we have created since the 1960s35,Case Study
This level is only logged on debug builds and should be surrounded by an if LOCAL_LOGV block or equivalent so that it can be compiled out by default,Coding Guidelines
An agent would be able to bring up veriﬁcation documents from Documentum using information from the CalWIN system and launch the veriﬁcation process with a single hotkey,Case Study
This paper examines and analyzes these problems and posits the problem of conventional propulsion system as the central issue to target,Case Study
Lifters would carry cargo ranging from satellites to solarpowered panels and eventually humans up the ribbon at a speed of about 118 miles per hour 190 kmhour,Case Study
All gains and losses unrealized and realized on equity security investments are recognized in OIE,Financial Reports
Bring space travel closer to ordinary people as something that is relevant and feasible,Case Study
Examples Prose form Correct Incorrect XML HTTP request new customer ID XmlHttpReques t XMLHTTPRequ est newCustomerId newCustomerI D inner stopwatch innerStopwatch innerStopWatch supports IPv6 on iOS,Coding Guidelines
This includes primitives Strings immutable types and immutable collections of immutable types,Coding Guidelines
Q Compared to my peers I tend to take more risks in life,Case Study
However by combining human strength with that of robots greater strength speed endurance and adaptation can be achieved,Case Study
 Currently NASAs cost for the construction of the Orion and Ares I alone is 35 billion not counting other countless innovations that could and should take place in rocket science,Case Study
 D Chow New Rocket Plane to Begin Space Tourist Launches in 2014 Spacecom 08Jun2012,Case Study
 G Lubin Commercial Spaceflight Is Getting Really Cheap Really Fast Business Insider 14Sep 2012,Case Study
Free cash flow is cash flow from operations reduced by Purchases of property and equipment net of proceeds from sales and incentives Free cash flow less principal repayments of finance leases and financing obligations is free cash flow reduced by Principal repayments of finance leases and Principal repayments of financing obligations Free cash flow less equipment finance leases and principal repayments of all other finance leases and financing obligations is free cash flow reduced by equipment acquired under finance leases which is included in Property and equipment acquired under finance leases principal repayments of all other finance lease liabilities which is included in Principal repayments of finance leases and Principal repayments of financing obligations 4 5 6 YY  Change 16  NA 36  31  84 12  430  6  6 1 1  1  7 NA 26  NA 23  NA 10 NA NA NA 5 NA NA 29 29 12 13 AMAZONCOM INC,Financial Reports
The satellite would also climb higher at this point reaching up to 100000km above the Earth surface and become the counterweight platform at the end to hold up the system upright,Case Study
Available httpwwwnasagovexplorationcommercialcrewblueorigin padescapetesthtml,Case Study
Remember that exceptions are your friend,Coding Guidelines
To summarize liquid propellant rockets are currently the most powerful in propulsion systems available in terms of gross thrust,Case Study
Very well known abbreviations like max or min and ones already very commonly used across the code base like ttl are allowed and encouraged,Coding Guidelines
Line lengths up to 80 or 100 characters are acceptable,Coding Guidelines
In fact it is estimated that more than 30000 reapplied technologies from space exploration are now used in homes schools offices markets outdoors fields hospitals etc 62,Case Study
Their origins were from 14 different nations including Korea China Japan Thailand Saudi Arabia Mexico Brazil Ukraine USA Tunisia Colombia Portugal Poland and Croatia,Case Study
NonGAAP Financial Measures To supplement our condensed consolidated financial statements which are prepared and presented in accordance with generally accepted accounting principles in the United States GAAP we use the following nonGAAP financial measures revenue excluding foreign exchange effect advertising revenue excluding foreign exchange effect and free cash flow,Financial Reports
We do not use the phrase documentation comments instead using the common term Javadoc,Case Study
Signify Accelerates Innovation and Drives FirstTimeRight Using RPA  Go be great,Financial Reports
F Result from the post survey Q What is your age,Case Study
Goddard launched his first rocket in Auburn Massachusetts in 1926 and continued to build engines and more complex rockets into his later life in New Mexico,Case Study
Underscores may appear in JUnit test method names to separate logical components of the name with each component written in lowerCamelCase,Coding Guidelines
She plans to pursue graduate school to study Physics in the near future and hopes to become a researcher in Astrophysics,Case Study
Simulated prototype of space elevator from Dvorsky 2013 The space elevator is an alternative way to reach space that has been proposed by a handful of futurists imaging a mechanism that could make a scenario like Jack and the Beanstalk possible7 17,Case Study
It is through this aspiration that we came to develop many technological innovations that we now have come to enjoy in everyday life it is through this aspiration that we will surpass even higher boundaries and become a spacefaring civilization,Case Study
Female C Transgender D Other Please describe _________________ How would you describe your race,Case Study
A Java source file is described as being in Google Style if and only if it adheres to the rules herein,Case Study
In future renditions of the study it would be more effective to speak louder as the survey comments suggested,Case Study
b Liquid propellant Liquid propellant rockets are a lot more powerful than solid propellant rockets,Case Study
Like the sun magnetism from the Earths and other planets magnetic fields are forces that are ever present throughout the universe however they have been entirely uninvestigated,Case Study
Class names are typically nouns or noun phrases,Coding Guidelines
Available httpwwwspacecom11353humanspaceflightdeaths50yearsspacemissionshtml,Case Study
The shuttles even flew secret missions for the Departments of Defense and played crucial roles in constructing the ISS26,Case Study
 Specific constructs 481 Enum classes After each comma that follows an enum constant a line break is optional,Case Study
Soon the investments are predicted to flow in at five times more than what NASA will be doing for human space flight by 20202 10 11,Case Study
 of participants got it right,Case Study
We compensate for these limitations by providing specific information regarding the GAAP amounts excluded from these nonGAAP financial measures,Financial Reports
Beneﬁts Reduced costs and risks faster turnaround for veriﬁcation and fewer human errors,Case Study
BeneﬁtsThe county had over 2000 agents using this system which translated to countless hours saved in veriﬁcation time alone,Case Study
Curvature is related to expansion contraction elongation torsion and bending of an elastic body,Case Study
On Dec 6 2010 NASA finally ejected its NanoSailD nanosatellite into low earth orbit for it to demonstrate the solar sail system55,Case Study
In some cases the convention has changed in important ways and older code might use a deprecated pattern or library,Coding Guidelines
The means of all these 6 categories were between 3 to 4 mean standard deviation first question second question third question fourth question fifth question sixth question 3421 1287 337 128 3632 1261 3474 133 347 137 287 126 Background Knowledge of Space Travel,Case Study
These forwardlooking statements are inherently difficult to predict,Financial Reports
Issues that justify logging at the WARNING level might also be considered for reporting to a statisticsgathering server,Coding Guidelines
In the same year US Commercial Space Launch Amendments Act CSLAA was instituted to have Federal Aviation Administration FAA regulate the safety of commercial human spaceflight in the US,Case Study
Amazon Keyspaces supports the same application code Apache 20 licensed drivers and developer tools that customers running Cassandra workloads use today,Financial Reports
On the whole however the results demonstrate some evidence that an informative presentation on the history problems and solutions of space travel helped the publics perceptions to change,Case Study
Avoid lengths longer than about 130 or 160 characters including the length of the tag if possible,Coding Guidelines
Other income expense net 522  35 74 2 1083 117 40 53 1538  9 Segment results The following table presents our revenues operating income loss stockbased compensation SBC capital expenditures and depreciation amortization and impairment by segment in millions unaudited Quarter Ended March 31 2019 2020 Revenues Google1 Other Bets Hedging gains1 Total revenues Operating income loss Google1 Other Bets Reconciling items12 Total income from operations Stockbased compensation3 Google Other Bets Reconciling items4 Total stockbased compensation Capital expenditures Google Other Bets Reconciling items5 Total capital expenditures Depreciation amortization and impairment Google Other Bets Reconciling items4          36032  170 137 36339  9188  868 1712 6608  2612  123 34 2769  4534  59 45 4638  2529  84 0 40975 135 49 41159 9270 1121 172 7977 2988 135 67 3190 5663 104 238 6005 3013 92 3 3108 1 2 3 4 5 Total depreciation amortization and impairment Hedging gains which were previously included in Google revenues are presented separately,Financial Reports
Other agents can be also included to make the mixtures easier to fabricate51,Case Study
_T_ Until now a passenger ticket into space cost about 20 million,Case Study
Available httpwwwspacecom701540yearsmoonlandinghardhtml,Case Study
Any comment that communicates the idea of fallthrough is sufficient typically  fall through,Coding Guidelines
_____ What is your approximate yearly income,Case Study
As commercial launches were prohibited for the US government space program this instigated the development of private sector space exploration companies,Case Study
It is expected that NanoSailD will stay in lowEarth orbit for 70  120 days depending on atmospheric conditions55,Case Study
With this growing problem of space debris a larger systemic effort was begun in 1995 by NASA which issued the first comprehensive set of guidelines for orbital debris mitigation in the world,Case Study
It adds a tank of high pressure gas such as helium that is unreactive inert and light to the propulsion system,Case Study
Note that this only applies when there are no block tags such as return,Coding Guidelines
Some participants chose to answer with I am not sure even when given yes or no answer choices 2355 147 324 324 of the participants respectively answered that they were not sure,Case Study
A There were 21 females 583 and 15 males 417,Case Study
The two most common binders are polybutadiene acrylic acid acrylonitrile PBAN and hydroxyterminator polybutadiene HTPB,Case Study
Within each block the imported names appear in ASCII sort order,Case Study
These complexities resulted in hundreds of business rules making process automation imperative,Case Study
For example software bots now monitor each account daily so they can keep owners uptodate on billing,Case Study
 Import lines can go over the limit because humans rarely see them this also simplifies tool writing,Coding Guidelines
On September 11th 1997 the US spacecraft Surveyer that was launched on November 1996 reached Mars and entered its highly elliptical orbit to closely investigate the surface of Mars,Case Study
This is one possibility private enum Answer  YES  Override public String toString  return yes   NO MAYBE  An enum class with no methods and no documentation on its constants may optionally be formatted as if it were an array initializer see Section 4831 on array initializers,Case Study
Rob Meyerson president and program manager of Blue Origin stated that providing crew escape without the need to jettison the unused escape system gets us closer to our goal of safe and affordable human spaceflight p133 These developments in commercial suborbital spacecrafts are the fruit of human creativity and passion that persisted in the face of formidable technical challenges and financial constraints,Case Study
Likewise NASA has examined its own organizational integrity so that it would not continue to rely primarily on outside contracts for important skill and experience based functions due to a huge loss of their own workforce,Case Study
In addition these measures may be different from nonGAAP financial measures used by other companies limiting their usefulness for comparison purposes,Financial Reports
In fact this has been pointed out as one of the main reasons for the lack of progress in the last few decades in space travel,Case Study
 new int 5 6 and new int  5 6  are both valid Between a type annotation and  or ,Case Study
The number of manned space flights has also decreased,Case Study
Maintain production quality for test code Maintain the same quality for production and test code,Coding Guidelines
When a SuppressWarnings annotation is necessary it must be prefixed with a TODO comment that explains the impossible to eliminate condition,Coding Guidelines
The principle behind the field propulsion is to assume that space as a vacuum contains a substantial physical structure which can be interacted and used as propulsive thrust force,Case Study
 Excludes the impact of Whole Foods Market,Financial Reports
Part A Interests Please answer the following statements on a scale of 1 not at all  5 very much,Case Study
For more information on these nonGAAP financial measures please see the tables captioned Reconciliation of nonGAAP results of operations to the nearest comparable GAAP measures Reconciliation from net cash provided by operating activities to free cash flow and Reconciliation from GAAP revenues to nonGAAP constant currency revenues included at the end of this release,Financial Reports
Digital product subscriptions that provide unlimited viewing or usage rights are included in Subscription services Includes product sales where our customers physically select items in a store,Financial Reports
John Mankins the manager for advanced concepts for NASA talked about one of the ideas from NASA about what to do with the space shuttles was to launch space habitats which is to get as many people to live and work in space,Case Study
These nonGAAP financial measures also facilitate managements internal comparisons to our historical performance and liquidity as well as comparisons to our competitors operating results,Financial Reports
What is more the force of the levitation achieved by a disk that is only half a micron thick is 70000 times its own weight,Case Study
 Space Station Britannica Online Encyclopedia,Case Study
The private space flight industry is definitely increasing in volume with a lot of players rising to benefit from the profitable market for public suborbital flights,Case Study
This increases the readability and maintainability of your code and reduces the likelihood of error,Coding Guidelines
These complexities resulted in hundreds of business rules making process automation imperative,Case Study
